用户名,评论,评论时间
真理在朕,"南观这个地方就是钓鱼，然后现场加工。首先说这个地方，走京港澳告诉大件路下，一直向西，大概6公里，看路标，右转，一直大概3公里，左转，进山区，顺着山路一直走就行了哦！大概2公里就到了！路左手边有停车场，垂钓园在右手边。因为是小鱼池，鱼很好钓，想感受钓鱼乐趣的话就差一些！环境不错！他家爱养藏獒、猴子什么的，菜的味道，鱼的做法，干烧、酱焖、干炸都不错					",2015/4/19
阿雯irenebin,去年去过，等着今年，哥们们已经开始筹划了。,2015/4/5
xhshe,味道不错，重点推荐怪味罗非，只是不是每次都吃得到。每次必点炸鲫鱼，蒜烧回鱼，停车场略小，免费停车。,2014/10/3
sjb11,整体还不错，就是奔着吃鱼去的，价钱肯定比在城里饭店实惠，关键是新鲜，环境也挺好，还养了些小动物，孩子玩儿挺开心,2014/8/15
大尾巴狼1234,味道很好，钓的五斤的鲟鱼，一半红烧，一半清蒸，好吃，还会来。,2014/7/19
larryzhang33770,感觉不错，环境很好，饭菜速度快，口感好，带全家玩一下午，钓了不少鱼，吃顿晚饭共花420元。,2013/4/21
设计师_张,每年夏天都会来这里钓鱼吃鱼，鱼的味道很鲜美，带家人也来过并得到家人一致好评，推荐炸花椒盐，干烧红烧怪味糖醋以及炸小鲫鱼，味道都8错...,2013/1/11
playngirlmona,开着车来这里钓鱼休闲还是不错的，地方好找不堵车，环境不错小池塘鱼很多，比较好钓，我不是专业的，业余爱好钓到鱼就行了，是的休闲垂钓的好地方。,2011/1/4
子田,感觉挺好首先自己把鱼钓上来然后我们自己烤着吃这两步我感觉第一步更具有挑战性也更有意义真的考验了我的耐性鱼的味道一般吧,2010/9/20