用户名,评论,评论时间
大特特的好妈妈,进门各种小动物，有亭子，桥，环境不错,2019/4/13
夜旎,赶上五一放假来的，人很多，服务员态度极差，吧台大姐说了空调有遥控器，你自己挨个找单间翻腾吧！如果大家想找气儿受的话来吧来吧呵呵哒！！,2019/4/12
小YI巴鱼儿,看到网上的评价，开车过来的，五一堵车也开了将近两个小时，到这时已经12点半了，但是吃饭的人依然很多，等了半个小时才等到了桌子，上来的饭菜应该是我吃过的农家院里最难吃，只会来一次不会来第二次了。,2019/4/9
KKKKKa01ZS1,南观这边儿常来的就是双新和绿荫，双新环境地方小一点，但是环境好一些，有小山小桥小动物钓上两尾鱼，金鳟刺身，虹鳟烧烤，再点上几个农家菜，不错不错。,2019/4/9
寄你温暖,除了菜凉了不给热以外别的说不说没用就是你吃饭慢你活该菜凉热时不赶紧吃不管什么菜凉了就是你吃得慢想让给你热热那是不可能的所以来着必须吃饭快要不凉了就倒了点新菜,2019/4/7
取下夹克的桔子,边吃边赏山水，可能是节假曰，人很多，用餐等候时间较长，清蒸“鲟鱼”，味道不错，碗蒸肉，忒肥，家常豆付也不错。。。,2019/4/1
bearsabc,园子很大，还有小动物观赏。我们买的鱼，现场烤的，很赞，推荐,2019/3/23
鲁小丽,"十一放假带家人来此一游，地方很好找，跟着导航就行。当天比较凉，穿个羽绒马甲正好。天凉的缘故，鲫鱼根本不吃他们的饲料。去隔壁家借的鲫鱼食废老大劲吊上来四条。又要了一条旬鱼。吃的招牌特色炸鲫鱼，垮炖旬鱼，味道特别棒。有孩子的朋友，有福了，园内各种小动物和花花草草，适合吃饱喝足照照像！					",2019/1/23
sxxlion,"朋友带着来的，说每次都来这里钓鱼吃饭。停车位有点紧张。一进门有猴子一家三口，豪猪一家三口，右手边是鱼池，分几块，鲤鱼，罗非鱼等，可以自己钓，虹鳟鱼只能捞，钓了会没钓上来，自己捞了两条，鲤鱼红烧，虹鳟鱼烤，味道可以。					",2018/11/9
晗^_^涵,"钓鱼池子不大，有鲟鱼青鱼草鱼鲤鱼鲫鱼等几种，不过国庆去的那天，只有一个鲟鱼池子上鱼，其他池子就没见有人钓上来过，鲟鱼是最贵的48元一斤。院子里有小动物，孩子们喂小猴子兔子龙猫豪猪，忙的不亦乐乎，当然院子的味道也因此不好闻					",2018/10/13
飞舞的竹蜻蜓,"经过几次对比之后，每次都来这家吃，南观最好吃的一家。老板人也特别好服务：农家人实在，不要指望城里的高端服务哦环境：有山有水有小动物，小朋友来了也不会寂寞价格：鲜鱼，可以自己钓鱼也可以直接要求老板帮忙打捞，味道没得说！尤其是烤鱼特别正点					",2018/10/7
跑步的小猪,"第二次来了，垂钓区域很舒服，几个可选择的鱼类池塘有鲟鱼、罗非、丁桂、鮰鱼、鲫鱼、草鱼、青鱼、鲤鱼，价格也差不多这个顺序；鳟鱼现在不钓是捞的了，烤金鳟真得很棒。这次垂钓成绩没有上次来时好，帮助捞鱼的师傅说是因为天气凉了。总结一点经验，每个池塘深浅不一，鱼儿都是贴底儿游的，所以换池塘垂钓时一定要及时调整浮漂的高度和鱼线的长短哦。					",2018/10/7
小小小小小猴只,"服务很周到，钓鱼🎣钓不上来旁边的师傅会给指导。实在钓不上来可以让师傅直觉给捞。鱼类🐟品种齐全。鲤鱼、草鱼、青鱼、虹鳟鱼、回鱼、罗非鱼、鲫鱼、等。明码标价。小院挺大、但气味真是不太好，院里有猴子🐒、龙猫，好多猫，再加上鱼坑那味道，实在是有点不好闻。罗非鱼我们烤的、青鱼水煮的、回鱼蒜烧的。水煮的最好吃、烤的有点咸，蒜烧的不太入味。葱花饼不是现烙的。棒渗粥也是凉的。米饭🍚太硬了。酸辣土豆丝太好吃了。神一般的上菜速度。服务员大姐态度特好。四个人，六斤鱼足够，我们钓了八斤没吃完。一共花了420。一点都不便宜。下次不会去了。					",2018/10/7
毛毛marimonn,"周末去钓鱼大众点评搜了好多垂钓就这个离着当时所在的门头沟区稍近些路上经过很多倒闭的垂钓园去的路有一段走的村子里路不太好这个垂钓园从门口看人蛮多的环境也不错比起旁边的计时垂钓好太多了由于去的时候已经过了中午但是还没吃饭想先吃鱼就让人先给捞了一条我比较怕刺吃的是鮰鱼肉比较死听别人讲青鱼比较好吃吃完饭后去钓鱼钓了三条青鱼两条鲫鱼带回家一共不到三百块感觉蛮值哈哈哈当天阴天气压低鱼不愿意咬钩儿不过还是把青鱼王调到了大概七斤重左右工作人员非常热情还教怎么钓非常有趣～感谢大叔嘿嘿～					",2018/10/6
饥饿的狐狸,"只要休息，闺女就会想来这里。环境好是一方面。主要还是菜做的好吃😋。孩子爱吃，吃的也多。今天点的几道菜一般都会点，因为确实很好吃。鱼🐟还没做好，先发菜的照片。今天来这里又有变化，一进门有个鱼池，很多金鱼很漂亮。还有很多品种的猫咪🐱。					",2018/10/2
bambi_f,"孩子自己钓了2条鱼，管理员做了指导的。环境挺好的，有自己的停车场。钓的三条鱼做了垮炖、烤、怪味怪味鱼是此行的惊喜，味道非常赞下次去还要点另走的时候东西遗落了，联系了老板，热情的帮忙邮寄了。推荐大家去噢					",2018/9/17
博宝6938,"0分差评！非常差的服务，收钱的绷着张臭脸咆哮，跟谁欠了她八百吊似的，环境脏乱差不说，还贼热，桌子椅子都是掉的饭，地上就跟甭提，太脏了，鱼也没有以前好吃，所有的菜都没有味，现在比以前差远了，没有什么人吃饭，主要是味道和服务都极差，建议大家不要去了！					",2018/9/10
peachvodka,"去过很多次了，虽然鱼不是很好钓，但是，条件也还很好。节假日人很多，有的时候连鱼竿儿都不够了，鱼有很多种做法，水煮鱼酸菜鱼，和糖醋鱼是经常点的。周围的环境还不错，空气很新鲜，适合周末一日游。每年五一左右开业，据说附近很大一片地方都是这家的。					",2018/9/6
草莓0711,吃了好几年了，南观就属双新环境最好，小动物多，带孩子来的好地方，可以喂鹿，喂🐒，喂兔子，豹猫也有,2018/8/20
果果妈_1389,人比较多，停车都满了，农家院的典型,2018/8/11
雪莱_3083,垂钓园水浑浊不堪到处都是苍蝇，太恶心了。好多小动物就被随意关在小笼子里，又脏又臭，涉嫌虐待小动物！,2018/8/5
lili_24yang,环境的两星是给小动物的，味道实在是太难吃。刚切的鱼丝毫没有新鲜劲儿，烤的皮肉分离，皮糊肉干，花椒芽儿干脆是花椒梗。来一次足够，有山有水离得近是亮点，也许人少时候再来会有不一样的感受吧。饭菜实在不敢恭维,2018/7/1
爱吃肉的猫876,"最近连着两周去房山钓鱼，第一次本来打算去田园，路上无意中看到了大众点评说双新有小动物，就直接去双新了。第二次想体验不同的农家院，就去了田园，结果比较下来还是双新比较好，下次一定果断来双新。首先说双新这里钓鱼很棒，每个池子都写着什么鱼，工作人员如果注意到你长时间钓不上来鱼，会给你做指导，也会调整鱼竿，让你更快体验到钓上鱼的乐趣，当然你也可以问工作人员，而我们去田园那天人很多，池子也大。完全搞不清自己钓的鱼池里是什么鱼，因为没写，只能一个个问。工作人员还爱答不理。其次，双新的菜单虽然没有田园和大鹏的那么丰富，田园有炸咯吱，双新没有，这个孩子比较爱吃。但是感觉双新起码吃的是自己钓的鱼或者选的鱼，我们钓鱼不就是为了体验那种感觉。但是，第二次去的田园，态度实在是让人难受，流程是点完鱼，进屋点菜，刚下单连十分钟不到，炖鱼就好了，紧接着各种菜，连杀鱼洗鱼的时间都不够，更何况要炸炖切，所以可以肯定上来的绝对不是自己选好的那条。第三，双新那个老板态度也比较好，北京人说话很敞亮，走的时候还让再来，而田园的老板虽然送了棒渣粥，但是收钱的大妈那脸拉的别提多长了，出来玩也不是看她脸色的，卖鱼的工作人员也是爱答不理的，以后大不了不去了。下面图一图二是双新的两斤四两的鱼，一鱼两吃。量比较正常。图三是田园两斤的鱼，一吃。总感觉量不够，因为本身从时间上看肯定不是我们选的那条鱼，而且生吃感觉鱼肉不那么鲜，像放了一会的。我们第二次去田园吃完饭，又转战双新掉了俩小时鱼。因为带着孩子主要是体验钓鱼的乐趣。而且儿子一直念念不忘双新的猴子和羊，虽然我觉得很臭，但是孩子喜欢。几家鱼的价格几乎一样，所以重要的是环境和态度。钓上来的鱼直接让他们给收拾好了，带走回家做。其实我很少花时间写点评，希望对大家有帮助。					",2018/6/26
哎呦喂呀嘞,"这一分给不得不打分，有0分绝对给0分服务态度差到爆炸，而且菜做得也没有以前好吃！质量越来越差劲👎我是带朋友特意过来吃的，结果让我朋友也生一肚子气！我们是花钱来玩的，不是花钱来惹一肚子气的。趾高气昂的也不知道在给谁看😤了不起啊？以前觉得他家特别火，人特多！今天来了发现清冷的很！我算是知道为什么了！服务行业做成这样不冷清才怪！再也不来了！差评差评差评！					",2018/6/8
Stellazhao,"在帝都的周末就要走起来玩起来high起来今天跟几个要好的姐们及她们的爱人一起来房山来吃虹鳟鱼家住这边姐们推荐了这里空气真好满眼的绿植山水这是个纳凉避暑的好地方就是蚊子多了点带小朋友来一定要注意防叮咬🐟烤好了去吃喽来不来？					",2018/6/3
我就是左右左右,"家离南观村很近，开车20分钟，从十多年前开始，就经常来南观钓鱼，吃鱼，附近的几家店都吃遍了，几家店比起来，说实话，鱼做的各有特色，也都差不多，近几年最常来的是双新，主要是双新这家的环境最好，有山有水，带朋友来也觉得比较有面子，显得有档次。不过，这家店真的是越来越没质量了，真的是店大欺客，以为来的人多了，知道的人多了，就无所谓饭菜的味道了吗？点菜时点了个菜团子，服务员就极力推荐自己家的菜团子特别好吃，可以多来两个，吃不了带走回家也可以吃，还好朋友比较理智，说先不要了……上来的菜团子咬都咬不动，应该是反复微波炉热过几次的……葱花饼也不是现烙的……人多，忙，可以理解，提前预备出来也可以理解，但是，自己家菜团子，饼剩了几天了有多难吃心里没数儿吗？还好意思极力推荐……这就是你们的问题了吧……客观的说，鱼的味道还可以，来这儿只能吃鱼，别的就算了……再客观点说，附近这么多家，鱼的味道都不错，没必要非得可着这家吃……反正我是不会再带朋友来这里了……不够丢人的……真的就冲着服务员极力推荐一个微波炉反复热过的菜团子，极力推荐这么次的东西让顾客消费，而不是推荐好的东西，我就绝对不会再去了！					",2018/6/2
betty_feng_0,"周末突然想吃烤鱼，约上三五好友来到房山吃虹鳟，据说整个村子都是做虹鳟鱼的，开了一路，选了双新，觉得这家装修风格特别独特。进去以后，院子很大，有大大小小的鱼池，可以提供垂钓，院子里还有小猴和金鱼池，吃饭的地方要走过一个小桥，院里有个湖还有很多花，可以溜达溜达赏赏景，空气环境都非常不错，烤鱼更是味道很棒。					",2018/6/2
王小喵和王小汪,"母亲节正巧赶上星期天，家人和亲戚都休息，大家就商量好来钓鱼之所以选择南观双新，是因为家里有个几岁的孩子，大人钓鱼，孩子根本坐不住双新的优点就是像个小动物园，里边有好多小动物：鹿、猴子、兔子、龙猫、还有猫跟鸟，热闹着呢大人钓鱼的功夫孩子喂喂小动物，多半天功夫就过去了，也省得孩子闹腾这次钓的鱼不多，够当天大家吃的，还是最爱鱼头泡饼和水煮鱼					",2018/5/23
夏雨7211,"一直在房山都不知道有这么个地方，公交不太方便，自驾还挺方便钓鱼为主，钓上来可以直接加工，3种吃法，有山有水，风景还可以，迎春花也都开了，人还不多，郊游踏春好去处我们周末来烧烤，有个烧烤架可以租，还点了点他这里的炒菜，农家饭为主，感觉味道还不错，但我们桌上菜特别慢，估计是忙不过来了，烤鱼比较一般，鱼不小，但不如怀柔那边的好吃周末有好多带孩子来的，这有猴子、兔子、鹿好多小动物，可以喂喂食，挺好玩中午饭点人比较多，过了两点人就少了，附近也可以溜达溜达，路边有迎春花					",2018/5/15
好人0315,"这个垂钓园有年头了，小时候就是来的这一家，他家不仅有鱼坑，还有兔子，鹿，龙猫，猴子，鸡，猫，鹦鹉等各种动物，去之前可以准备一些蔬菜，钓鱼的话最好自带钓竿和鱼食，因为感觉他提供的鱼食，鱼都吃腻了，根本不咬钩。。。。无奈最后让老板捞了三条鱼来吃。。。。青鱼做的水煮，不辣但是很香，烤虹鳟，从始至终的好吃，然后鲟鱼做的是红烧，到底是老店，鱼做的都很好吃！唯一的遗憾就是，这次我们一条鱼都没有钓上来。。。。。					",2018/5/11
4612,钓鱼还挺有趣味性，几分钟一条，特别好钓，有人看着，不能扔回去。餐厅服务特别不好，爱答不理的没有笑模样，上鱼速度真心慢。其他还好，有小动物，带孩子玩可以。,2018/5/1
teamkazuya,一定要早点把鱼送上去，要不就等吧,2018/4/23
北京的小黄黄,11点不到，停车就比较紧张。有几围鱼池，吃饭位置比较紧张，可以留一个人先占位置，椅子占好，其他人钓鱼。不想钓，让工作人员捞也可，然后对方给一个牌，把牌交给点菜人员即可。上菜速度不慢。口味不错。,2018/4/13
熊猫_8319,老爸钓了***，鱼头泡饼好吃。野菜挺贵。还有烧烤，烤串还可以。动物很多景色不错，一进村，第一家就是。所以客人多。十一去的，人还行。五一还想去,2018/4/4
八九柒拾二,大鱼非常容易上钩，直接拿到厨房做成烤鱼或炖鱼。烤鱼没时间腌，没入味儿。,2018/4/1
憨豆先生_1010,好，不错，下次还会再去！！恭喜发财！,2018/3/22
远方深处有人家,星期三来的，人很多。味道不错。,2017/9/13
小眼笑笑,"在门头沟里按照导航走很准确这个地方是朋友推荐的非常的好依山傍水景色宜人刚进去就能看到几个大坑里面有各种不同的鱼想钓什么都有看评价说炸鲫鱼很好吃于是主攻鲫鱼坑鱼非常好钓基本上都能钓上来不得不说炸鲫鱼真的很好吃酥软有度鱼刺都可以吃还做了鲫鱼汤鱼汤非常鲜美还有钓上来了个草鱼做水煮鱼味道也很好下次可以再来尝试一下其他的					",2017/9/7
赞米,"在南观儿这个地方，有专门儿钓鱼的鱼坑，有没人管的也鱼坑，也有像双新垂钓园这种人工放养鱼池。各个鱼池放养的种类不同，你想吃什么鱼，钓上来可以直接做菜，在这儿美餐一顿，也可以带走。双新的老板很喜欢动物，养了很多活物儿，梅花鹿，猴子，鸟，猫，兔子，山鸡……还有好多h我叫不上名字的动物，活脱脱一个小动物园。					",2017/9/6
xiigua,"位置不堵车从北三环开过去要1小时15分钟吧。我们是上午去的，不到11点到的，人还好，不错多，因为朋友还没到我们就先开始说热热身先练练，因为是第一次，父母和我们都没掉过鱼。老公想吃鲟鱼，我看评论说鲫鱼干炸很好吃。所以打算掉鲫鱼，鲟鱼是不带鱼食单钩钓。太强悍了，等了一会就上钩了。鲫鱼我们前前后后也钓上来4条以后打算收手等朋友来再钓，因为怕太多了吃不了。朋友过了一会才到。经过了1个半小时才钓上来一条。不知道为什么。					",2017/8/3
冷邪路西法,"几年前来过，感觉这家挺大的。这里每家都弄几个鱼塘搞垂钓。周末带孩子过来玩，顺便吃这里的炸鲫鱼，鱼没有之前好钓了，动物种类多了，孩子一直喂小鹿和猴子。还有兔子，猫，龙猫鸡可以喂。我们钓了两条鲫鱼和一条虹鳟，鲫鱼好像18一斤，虹鳟是三十。又点了三个菜，一共200多。菜的口味偏咸，鱼都没怎么吃。					",2017/7/3
馨馨妈_396,"朋友原来来过说很好就带我来了，两个人点了一个酸菜汆白肉一个***的两吃，一半红烧一半清蒸，朋友告诉我吃鲟鱼要吃中间那根脊髓，吃起来口感像牛筋似的，很劲道。鱼很鲜，两种口味我更喜欢红烧的，清蒸稍微有点腥，配着葱丝姜丝沾汁吃会好很多，两个人最后鱼剩了四分之一，酸菜白肉的味道做的也不错，和葱花饼一块吃很好吃，我吃了好多酸菜喜欢这口儿。里面确实有好多动物，适合带孩子来，像个小动物园					",2017/5/23
djzhangwwt,"环境在农家院里还算不错的吧但是南观这边垂钓园基本都不差各家也差不多基本上傻子也能钓上来这里面的鱼都饿的不行了扔进去鱼食就上钩我朋友调虹鳟鱼一分钟不到就钓上来了吓死人钓上来的鱼必须要不能扔回去一不小心就掉了四条赶紧收手新手不用担心钓不到鱼也不用担心不会做鱼哪种鱼怎么吃都会推荐看自己喜好吧基本是草鱼青鱼水煮胖头鱼夸炖没有剁椒鱼头之类的吃法哈哈虹鳟烧烤鲫鱼炖汤油炸鲟鱼红烧他家不推荐清蒸我觉得是鱼草腥味太重清蒸不太好吧					",2017/5/12
朱么么园长,"鲫鱼个头不小，而且很容易上钩，可是虹鳟金鳟估计坐那一天也钓不上来一条，坐一排人没有一条上钩，不知道是不是不吃这种鱼饵，所以想吃就只能捞。我们钓了两条鲫鱼，一条干炸一条酱烧，干炸就是椒盐，超级好吃，酱烧第一次吃，还不错，就是黄豆酱烧汁～烤虹鳟嘛，这次真是有点儿失败，孜然料好少，而且外皮还烤焦了，里面的鱼肉又有点老。					",2017/4/20
callmedouble,"来双新很多年了，每次想吃鱼的时候都会来，环境幽静，鱼做的也好吃，多年前钟爱干烧青鱼，每次必点。最近又发现一个很好吃的酱烧鲟鱼，鱼肉鲜嫩做法也好吃，成了又一个必点的😄。园里还养了很多小动物，小猴子特别好玩，吃完了可以逛逛看看动物，是很好的去处					",2017/4/10
jiajia0915,"我想说价格提高了很多，菜品质量太差了？看看点的这几个菜，凉拌金针菇18元都是香菜，还小盘；看看我们点的三条鱼，水煮鱼的那是什么油啊，反复用的旧油理直气壮的，鱼的鲜味都吃不出来，还有最贵的鲟鱼48一斤➕25的加工费你就给我吃这个啊，鱼皮没很硬都没法吃，感觉带着鱼鳞，味道除了酱油味啥都没有，太坑人了，六个菜能吃的就俩烤鱼和河虾，要去的三思，请客就是丢人现眼！					",2016/10/19
xxinlichun,还不错老板不错上百菜也还可以,2016/10/7
cherry_chen0120,有梅花鹿，猴子，兔子，龙猫，孔雀～一个小动物园，孩子很开心，有山有水，环境不错。还会带朋友来的，对面有个小院停车，很方便鲫鱼比较便宜，炸着吃特别好吃，再加一句，中间的那个鲟鱼坑最好钓哈～,2016/8/20
xiaomi133136961,不错，价格合理，人均70元很值,2016/8/11
啊梓咪,钓鱼很好，不过不太会。鱼做的比较好吃，烤鱼挺棒的，刷的酱味道很好。鱼汤也不错，不腥。但是其他菜就一般了，地三鲜有一股怪味道。,2016/7/8
凤凰午夜,还好，这个村家家户户都是经营垂钓的，统一标价,2016/7/8
水冰,环境挺讲究的，还有好多小动物，鱼的味道也很好，唯一不满意的是服务员，态度。。。。,2016/7/3
curle,"第一次朋友带过来吃鱼，属于半山里夏天很凉快，鱼池挺多的，人也多，周末尤其是，金鳟生吃，虹鳟烤着吃，鲫瓜子干炸，太好吃了，价格还合适的，不贵。农庄里有些许动物，很适合带娃来玩，准备下次带父母出来玩。鲟鱼也超好吃！					",2016/6/26
福贵,"这一颗星是给捞鱼大叔们的，带着朋友来的，环境可以，帮着捞鱼的大叔很热情，餐厅的服务人员都是大妈级别的，出来玩就是图个心情舒畅，可惜吃个饭这个堵心，服务态度实在太差，说话都横着出来，是不是天热的都烦躁呀，一个个拉着大长脸，叫个服务员没人应那就叫老板呗，马上有人说了：“老板不在”，“没事叫老板干嘛”！我的天，我没事花钱到这挨数落来了？我们不是来找不痛快的，我们不是来白吃的，就冲这不会再来二次了，况且饭做的真的一般，如果硬件设施可以，服务质量跟不上回头客就不会太多了，至少我是不会再来了。					",2016/6/15
大脸白猫猫,"这个地方还是不错的，带小孩子来玩会，钓会鱼，钓上的鱼可以就地加工或打包带回家，农家菜做的味道一般，说不上精致或口味吸引人，服务人员都是当地大妈，服务态度良好，但是管理混乱，菜经常上错桌，结账时可能冒出来个你没点过菜出现在你的账单上，周边环境优美，偶尔来一下还是不错的选择！					",2016/6/6
迷糊de小新,"朋友推荐，还不错的地方，有个小停车场，大概能停十几二十辆车的样子（具体没数）。园内有几个池子钓鱼，印象中有鳟鱼池，鲟鱼池，鲤鱼池。个人觉得鳟鱼池最好钓，一下子钓上来三只鳟鱼，还挺爽的。餐厅在一个小山坡上，楼梯不长，算是有个小景色。连洗手间都是建在假山里面，挺有意思。农家院服务很热情，几个大姐虽然业务不熟练，不过态度倒是特别热情。菜品不功不过，烤鱼还不错，整体菜品略咸，如果口轻的话，得提醒厨子少放盐，炒鸡蛋就重新做了一次，咸得下不去筷子了已经。整天来说倒是还好。价格是真便宜，2条金鳟，1条虹鳟，1条鲟鱼，一桌子菜，13个大人，1个孩子，一共花了900多块，还是非常超值的。周末没事儿过来玩玩儿还挺好。					",2016/5/25
天天撸大串儿,环境好，依山傍水，四周绿色很的，是个天然的大氧吧，水是地下一百五十米的山泉山，所以鱼吃着特别的鲜美。,2016/5/21
只关注味道,感觉不错，孩子父母玩得都很开心,2016/5/2
荔枝冰冰,观察了一个上午，能自己钓上来鱼的凤毛麟角，吃鱼基本全是靠店里帮着捞上来，价格比较适中，总体味道还可以，就是停车位有限，来晚了停车比较费劲，周末来散散心还是不错的。,2016/4/23
千幻流光,环境不错，但鱼做的相当难吃，有股土腥味。价格比周边贵！,2016/3/18
空城旧梦丶,地理位置好，鱼好，服务周到，散心，钓鱼，必去之处。,2015/12/16
无肉不欢的芝士,位置还是很好找的，蓝朋友很快就钓上鱼了，但是池水浑浊把旁边人羡慕的呀但是做鱼的味道真的一般，吃的鱼竟然是苦的，，也不知道怎么回事,2015/11/24
爱的天使123,来过多次，很喜欢！！！！！！！,2015/10/5
FantasticBoy_2193,双新垂钓园我经常去，离我家也不远，是不错的选择。价格相对于其他垂钓园来说是不贵的，但可能是水质的原因吧时常会有浮萍，不算多，不碍事。双新垂钓园的烤虹鳟鱼超好吃，有机会一定要品尝！！！,2015/9/5
BoaRobin_5401,东西是不错，挺好吃的，可服务态度相当差，愤愤的，跟谁欠她钱似的，就为这态度，差评,2015/7/16
貓小妞,没觉得好吃，不知道哪来那么多水军说好吃…鱼倒是现钓的，不过稍微有点脏啊，吃出了个虫子…跟老板娘说换，态度还奇差…真是服了…再不会来第二次了,2015/6/28
兂吢誘惑,这里环境不错，鱼也很好吃，垮炖鲤鱼，烤红鳟鱼，非常不错，菜团子是萝卜馅的，味道不错！这里有很多小动物，兔子特别多，还有猴子，鹿和羚羊特别适合带小朋友来，吃饭还可以亲近大自然！,2015/6/23
