用户名,评论,评论时间
旭升,"荷花垂钓位于房山区青龙湖镇南观村南黄大街，开车不到一个小时的路程，村里养鱼池很多，荷花垂钓园没搜到就用双新垂钓园的侄置啦！10月5日早上六点半开始抽号，抽哪坐哪。鱼票二百元，微信转帐报名二百元，现场交费二百六十元。特大喜讯;标鱼，一个钓箱，三个一百标鱼现金标鱼。注意，本钓场为素坑，禁止:红虫，手抛窝，开钓前禁止提前打窝带饵，发现用红虫重罚二万元。					",2020/10/6
Little小Five,"周边都很多垂钓园，垂钓、餐饮一体的。这家园子挺大的，可以先垂钓，后吃饭，有很多带着小朋友一起来的。园子里还养着很多动物，猫、兔子、猴子什么的，在入口处就能看到，夏天的时候味道不是很好闻。吃饭要往里走，可以漏天，也可以在屋里，都是家常菜。					",2020/12/11
小小_小蚯蚓,"今天是来北京第三天，刚好礼拜六，就和几个朋友一起过来这边吃饭，点了几个菜，最让我怀念的是北冰洋的汽水和馍馍头，点了一个馍馍头两个人分一人一半，试一下味道，最后上来的一盘鱼，这条鱼真是万里挑一都难找，居然里面还会有所谓的龙经。这里可以自己钓鱼，然后给店里加工。这里也是出名的旅游风景区哦，山青水秀，放假什么的都可以过来玩。					",2020/8/29
张小葱_023,"南观来了无数次这家还是第一回带着孩子和老人就没有自己钓鱼让店家给捞的下手挺狠鲟鱼估计是给挑了条最大的怪我们没提前说所以就认了结果等了快俩小时我们都吃完了才上只能打包了选完鱼让去自己找桌外边的几张大桌真的不建议坐我们换了两次都能闻到一股一股的厕所味儿最后还是进屋了想坐包间里服务员让问吧台过去问了一嘴不知道是不是老板娘态度极横当时真想换别家了但我还是觉得鱼都给我做上了直接走不地道菜口味就是很一般了也没有什么特色一锅出的排骨都咬不动然后因为鲟鱼的份量重我们人均的价格并不低也吃过园田大棚王云一亭一筑都比这家好以后肯定不会来了					",2020/10/6
MIRROR_8927,"双新垂钓园是我去南观吃的第一家，总体感觉不错。依山傍水，正好在一个山坳里，背靠高山。流水垂钓其乐融融，园里还有不少小动物，如果带着孩子也不会影响你垂钓。他们家做的怪味鱼是我最喜欢的，当然这次也不能例外，一鱼两吃青鱼伺候。遗憾的是没喝两口呵呵。					",2020/10/27
匿名用户,"双新垂钓园位于房山区青龙湖镇，自驾上西六环40多分钟。特色体验：老少皆宜，有休息区，垂钓区，儿童游玩区里有小动物猫，猴子，羊，豪猪……，本园垂钓、加工、吃一条龙服务。鱼按斤收费，不同的鱼不同的价格，加工费20元。本次收获不小鲟鱼二条，鲫鱼三条共7斤多。上一刻还在池塘里自由自在游，下秒就上餐桌。吃自己钓的鱼就图一个新鲜，餐厅有各种炒菜，凉菜，各种烧烤串，还有野菜团子。					",2020/7/31
吃可爱长大的77,"南观这边有很多的垂钓园，这家双新垂钓园还是很不错的，老板态度很好，进门还有很多的小动物，猴子猫咪土拨鼠等可以带孩子来玩，进门钓鱼的地方，可以自己钓，不想自己钓也可以直接让人给捞，不同的🐟有不同的吃法，钓之前一定要问清楚哦～整体环境很不错～好评！					",2020/10/25
珠圆玉润,"来南冠烤鱼来双新就对了，没有雷！先说整个园区小环境挺好，鱼塘离餐厅有点距离，吃饭的时候不必闻着鱼塘腥味儿，这是我喜欢这家最主要的原因。老板特别爱小动物，现在养着小猫，小兔子，小猴子，豪猪，土拨鼠，小朋友来了可以去喂小动物，特别有爱。鱼可以自己钓，当然也可以请老板直接捞，钓鱼的话，鱼竿鱼食都店家提供，玩玩不错。要早点来，周末中午人很多，停车场小，不好停车，或者晚上来吃，人少很多。吃饭可以在屋里，也可以院子里，但是现在院子里太热，屋里就是很吵，沟通得靠喊，饭菜味道总体来说还行，无功无过。					",2020/6/7
荼靡,"一个情侣、朋友、客户之间的好去处地点在房山南观、进到那里都是垂钓园、之前都是去洋溢山庄、后来不营业了、相对比下选择了这家、里面有一些动物、🐒、🐰、🐶、🐱之类的、钓完鱼中午在那里吃了、自己钓上来的加工了一下、跟客户小酌一口、喝的白酒半年哪不想第二次喝了、哈哈哈					",2020/10/30
就是吃就是喝就是玩,"总的来说一般吧。开车过来到不算远。但是这里垂钓的一家接一家。各有各的特色。钓鱼爱好者的福音。我们今天来的这家就是钓上来就得带走或者是让他们给做了。中午我们就在这里吃的。农家院的后厨就别有任何要求了。有些脏。今天看它家人还挺多。它家一进门全是动物。猴、猫、乌龟、兔子、土拨鼠、还有个什么猪我忘记了。就是没人打理，卫生有些差。有洁癖的人谨慎。					",2020/8/17
食之有理0616,"垂钓园里鱼的品种很多，鲤鱼罗非鱼鲟鱼团鱼。钓上来之后直接拿到饭店里做。不过需要提醒一下的是，如果想吃水煮鱼的亲，注意问一下哪个品种的鱼可以做水煮鱼。因为我们想用团鱼做水煮鱼，被店家拒绝了……农家乐的环境挺清新的，里面还有猴子豪猪狸猫兔子山羊，小朋友很喜欢这些小动物，可以各种投喂，很开心。					",2020/10/6
丫宝很爱吃,"在旁边的韩建谷乐园玩完可以来这里吃饭这里是自己钓鱼，钓上来之后选择做法…有虹鳟、鲟鱼、胖头鱼、鲤鱼、草鱼好几种，根据自己的口味来钓吧。我们的经验是罗非鱼很难钓。除了鱼，这里还有农家菜可以吃。想吃烤鱼的话也可以单点虹鳟鱼来烤～					",2020/10/12
米粒的麻麻,"藏在北京近郊的一个小山村；听朋友说有个八十亩地村，村里家家都是经营垂钓🎣园的；特色是***🐟；这一次全家真的是慕名而来；特意找了一个工作日的时间拔草。门口有自己的停车场地；停车根本不是问题，不用担心没有车位；进门有很多小动物；🐒、🐰、🐱、🐶……都是店家自己养的。小朋友很喜欢；垂钓🎣池很多鱼的种类，环境也很好，干净卫生；适合带孩子；还有餐厅，直接加工；味道超好，厨师手艺不错特别推荐这里的菜团子和贴饼子，吃完午饭我们特意打包了6个贴饼子和菜团子回家吃；经济实惠的一个垂钓园；值得再带朋友一起来。					",2020/8/11
dpuser_26635285596,"就在山脚下的一个垂钓园，风景特别美，农家饭特别好吃。村里的鱼特别好，所以来这里一定要吃鱼。菜的份量很足，鸡蛋摊饼真是好吃，烤鱼也特别香。喜欢钓鱼的人来这里特别过瘾，鱼很容易上钩。门口还养着猴子、乌龟这些小动物，小朋友也可以逗逗动物。					",2020/10/4
小毛宝,"一个不是周末的下午，抱着试一试的心情，临时起意驱车前往房山南观村。幸运的是村口虽然有检查岗，但履行完登记和健康码程序后，果断放行，并热情协助我们介绍了恢复开业的情况，看来经济下行压力已经让大家都有感触。双新垂钓园，属于当地恢复营业较早的一家，我们选择了自己垂钓，加店家捞鱼的搭配模式。很快一条鲟鱼上钩，成为了当晚两吃的主力菜肴，而店家捕捞的金樽，则以烧烤形式呈现。浓郁的各式乡村菜品，静谧的青山绿水，配合上双新园依山而建的独特位置，能让烦躁的心情获得些许安宁。我相信，只要不是周末，这份宁静，一定可以令人心旷神怡，强力推荐前来体验。					",2020/5/26
可爱的西姆,"一直想找一个既能钓鱼🎣又能吃鱼🐟的亲子圣地。之前去过几个别的地儿，呆一天鱼也钓不上来也没的吃孩子都表示失望终于啊！在点评上找到这家双新了。满足我一切需求。一进门就是迷你动物园，孩子们开心极了。往里走就是鱼塘，不大，但足够满足我们这些垂钓小白。孩子钓上来鱼，旁边拿网的师傅会非常有耐心的指导怎么提杆，然后帮忙将鱼捞出来。捞上来的鱼可以直接在垂钓园的餐厅吃，也可以由店家帮忙收拾干净带回家。我们一行六人，四大两小，吃了两条红烧鲟鱼，味道还不错。我们一定还会再来的					",2020/7/19
蹦蹦哒哒,"有很多的小动物，很可爱我们四个人去吃的，一锅炖排骨很不新鲜，感觉都是因为疫情没人来所以食材不新鲜，鱼还是很好吃的，因为是新鲜的！炸花椒盐也很碎，味道还可以，但感觉花椒盐是冻过的，总体来说还是风景更棒一些					",2020/10/10
晓_578171,"老板真的很热情，说话很随和。村口有个岗哨，但是说明来意顺利放行。门口有个小停车场，停车很方便。院里有好几个小池塘，各种鱼都有，自己钓上来马上可以拿到后院半山的餐厅去做。院子里养着各种小动物，老板也是有心人。很喜欢他家的小羊，很粘人，就喜欢被撸今天我们钓的青鱼做的是怪味鱼，酸、甜、咸、辣的，很好吃。醋溜土豆丝也不错，上菜很快！吃饱了孩子还没过瘾，又到鱼塘钓了两条带走了，回家做水煮鱼去喽					",2020/7/31
曼联（ManUtd）,"环境不错，停车位充足！钓池按鱼的种类分的，鲫鱼、鲤鱼、回鱼、鲟鱼、鳟鱼。。。，本想钓只鲤鱼，再搞几只鲫鱼，结果不随我意，这两种鱼不咬钩，后转钓鲟鱼，果然鱼贵好咬钩，看官们懂的商家也得赚钱呀！搞了两条鲟鱼（一条两斤多吧）收钩吃饭！一条红烧，一条老干妈（炸的），外加点了肉串，四个炒菜，花了600多点，总体感觉还不错！以后有机会可以再来。					",2020/10/4
fiona_dean,"交通：开车西六环特别方便，下高速几分钟路程即可！特色体验：超好玩的一个农家特色小院，有山有水有好多小动物，适合小朋友游玩！有些世外桃源的感觉！可以自己烧烤、钓鱼、喝茶🍵聊天！有几个不同的鱼塘！环境优美！					",2020/6/29
啊_朱,"房山南观有好些垂钓园，今儿看这家人气挺旺的，就进来尝了尝，点了两条鱼，虹鳟（38元/斤），鲟鱼（48元/斤），他这的鱼基本上都是两斤左右一条，做法也有好多种，我们点了酱香的鲟鱼和烤的虹鳟鱼，然后又点了烤串和几个凉菜。鱼都是现捞现做的，很新鲜，但是就是太咸了，有点美中不足。烤串味道很好，四星推荐！最后说说用餐环境，小院环境不错，但是就餐的地方，椅子和桌子都有点脏。					",2020/8/8
断鳷晴天騛,"这疫情期间，去门房山吃🐟的还挺多！本人本来就热爱垂钓，北京城八区以及河北北京周边的地方基本都玩过，对于爱🎣不爱吃鱼的我来到南关村也品尝一下当地的做法，房山区南关村是一个之前没有开发的⛰️中村落，当地大队倡导的带动民俗村的旅游经济，对于怀柔这种自家的院子改成院中挖几个小坑放点不同的🐟种简单垂钓以及加工就见怪不怪了！这个村属于效仿基本每家每户都是大同小异，自己可以钓也可以让他们员工直接捞，对于带着小孩自己真没钓过鱼的女士也玩个新鲜吧！怎么说自己钓的吃着也有感觉这家菜品做的还算是凑合了，比那种特别懒的农家院强点，但是到饭点的时候菜品也有点凑合，看这贴饼子里还吃出了东西，对于农家院要想生意好菜品整体都得提升不是一锤子买卖！					",2020/8/1
dpuser_18840935068,"周末与朋友来房山游玩，中午来到双新垂钓园。虽然没有钓上鱼，但是咱可以捞啊！垂钓园依山傍水，人气很旺。用鲟鱼做了红烧，再点个烤虹鳟，烙饼卷鸡蛋配苏子叶咸菜，一桌子妇女吃得很满意。农家乐用餐环境一般，不能苛求，大家吃的高兴玩的高兴就好了					",2020/8/15
爷们儿不坏_8549,"周末及节假日人很多，因此服务员就显得尤为珍贵了，总体不错随叫随到的。他家在南观算一号，这些年我没去过别家，也许因为他家门口有个停车场吧。一进门有个笼子，里面有猴什么的，小朋友甚是喜爱。右手边是垂钓区，各种鱼分池而居，想吃啥就钓啥，完事要称、拿牌、穿吊桥上山找位点餐即可。这种先钓鱼再吃鱼的感觉对于城里人来说还是比较独特的，带孩子体验一下自给自足的生活乐趣挺好。					",2020/7/8
lampardnic,"没事来这里休闲一下很不的，可以钓鱼，钓上来之后接现做，绝对的新鲜，我们先钓了一条刺少的鲟，炖着吃的，看黑乎乎的一大，但是道很，鱼很嫩。本来吃烤鱼，但是这个鱼不能，于是我们又捞了条虹鳟鱼，烤着吃，味道也很好，相比来说，炖更嫩。					",2020/10/25
lilyl77,"味道不错，院子里有河，能自己钓鱼，也可以直接买着吃，价格都是一样的，一进门左手有几只猴子，还有豪猪，右边有鱼塘，乌龟，往上边走还有烤肉串的，点菜，人特别多节假日，建议提早去，农家菜做的很好吃，价格适中，很好。					",2021/3/22
琪然自德,不虚此行啊有很多小动物老板人也很热情钓鱼有几个鱼池只有鲟鱼好钓便宜的一天也钓不上来。。。。。可以加工各种做法味道不错~,2020/11/28
爱松_8290,烤鱼做法很多，一定尝试，味道真不错，一次要了三种口味，希望再推出新的菜品,2020/11/14
Kitty雪0804,回娘家丈母娘带着来的，听说是大队办的，吃饭钓鱼赏风景，很不错,2020/10/29
longlong,太坑人了！土豆牛肉全是土豆！还贵！排骨炖豆角全是豆角,2020/10/18
nana_19,"山上山下都属于这个园，不仅可以垂钓，还有很多小动物，吸引了很多小朋友。猫咪、龙猫、乌龟、兔子，甚至还有一笼小猴子，往山上走还有羊。植物也不少，看到辣椒和柿子。过小桥半山腰有烧烤，再往上走是饭店，钓到的鱼可以加工，怪味鱼和烤鱼味道都很一般，菜品以农家菜为主，价格不低，量也不大。					",2020/10/11
唾沫星,"挺好的，挺好的，我点了条鱼吃，然后这会反正鱼都是现弄的，然后感觉挺挺好的，然后就是鲨鱼的过程有点残忍，或者先看实在是，但是该看也得看，那办法对不对？你们那是因为不看就不看，但环境还绿化。各方面的环境都挺小资的不错					",2020/10/9
奎爷京范,"上次来有一只小猴子，扒着猴妈身上，这次来二胎都这么大了。鹿不见了，换了一只豪猪和一只呆萌的地鼠，据说玩的打地鼠就是这货。我们四点左右到的，天气热，不好钓，快五点的时候鱼饿了，开始频繁上鱼。有些鱼需要换鱼食，要不钓不上来。					",2020/9/30
天使,"既可以吃鱼的又可以垂钓，带着家人可以先玩玩，享受一下垂钓的乐趣，不同的鱼有不同的坑，想吃什么就去哪个坑钓就可以了，烤鱼很好吃，就是有些咸了，门口还有一些小动物，是个好吃又好玩的地方，周末休闲时可以来自给自足一下！					",2020/9/24
dpuser_5540489183,"周末出门遛弯，来到这里，这一片很多农家乐垂钓园，这家的位置比较好，下午钓鱼的时候太阳被挡住了，不会太晒。鱼不是特别容易钓，感觉鲫鱼和鲤鱼容易上钩些，其他的鱼类就要看运气了，我们一下午都没钓到，最后让老板捞了一条虹鳟。烤虹鳟很好吃，其他的农家菜也很不错，另外这家农家乐养了很多小动物，小朋友来的话应该会很喜欢！					",2020/9/15
Aries,"疫情已经得到改善，好久没有去南观村钓鱼，每次想吃鱼就会来到飞达。找个好天气，开车50分钟来到老地方飞达钓鱼，碰巧遇到飞达有婚宴酒席，不能接待。重新找了个地方绿荫垂钓园，地方不错，鱼很好钓，做的味道怪味鱼有点咸。环境还不错。					",2020/9/14
崬京番外地,有有小动物大人钓鱼孩子也有地方玩环境小桥流水有亭子做菜味道不错烤鱼最赞,2020/9/2
djzhangwwt,钓鱼吃饭爬山一气呵成，怪味鱼推荐,2020/9/2
Sahara0517,个人感觉环境规划的很好，但是就是卫生差了点，我们去点的自助烧烤，100元不限人数，不限时间，玩的还不错。钓鱼掉了好久才掉到一条，加工费一共80元，但是味道一般，里边的茄子吃了2口，鱼几乎没吃,2020/8/29
阿贵,环境很好院里养了很多小动物价格也不贵味道也不错特别适合家里人聚餐或者带孩子来玩,2020/8/29
唐唐163163,炸鲫鱼味道还是很赞，就顾着玩了，忘了拍照片、但这次去我们几个人都没钓到鱼，后来让大爷帮忙捞的，鱼儿不爱上钩了呀、是不是都聪明了、哈哈哈哈,2020/8/22
lsnow322,真的很不错，下次还要来。鱼好吃，喜欢水煮鱼,2020/8/20
钻钻,周六下午去，人还是不少，渔具和鱼食不要钱，调上来才要钱，这个不错。,2020/8/18
liligogo2004,N次打卡双新垂钓园了，鱼的种类很多，我喜欢钓回鱼和虹鳟鱼，小朋友很专注的钓了几条小鲫鱼，高兴的饭都忘记吃,2020/8/17
龙珍,钓鱼🎣吃鱼，老板热情，空气清新还有小动物，不错。,2020/8/12
张莉_3629,"在门头沟山里面的一个垂钓园，跟着导航走很好找，一片都是钓鱼的地方，有不同的鱼塘，老板提供鱼竿鱼食，省去了自己带的烦恼、一进门就能看见老板养的三只猴子，海有羊，猫，乌龟，鱼，饭馆能吃饭有烤红鳟，最后很赞的是老板那可以把你的鱼收拾干净了拿走					",2020/8/12
皓月儿0514,"垂钓环境还可以，平日人不多，鲟鱼容易钓上来，46一斤院内有些小动物可供小朋友投喂，猴子，小白兔，小狗从早上垂钓到中午顺便用餐，点餐时要求菜品免辣，结果上来还是辣的，也不给更换，这真是很无语了，无奈只能从新点一份					",2020/8/11
匿名用户,"大众点评网搜到的，排名比较靠前就去了，成功钓上一条鲟鱼一条回鱼一条罗非，感觉贵的鱼更好钓。总体还挺好的吧，钓完鱼现场加工吃饭，鲟鱼红烧了味道一般般，回鱼是和豆腐一起垮炖的不错，还点了一些农家菜。都挺好吃。罗非带走了，唯一一点是，和老板说了要鱼膘，垮炖时一起，老板在下面还答应多给几个，结果一个都没见到。当时白感谢半天。走的时候说什么下次来给补上，觉得套路有点深，不实在。					",2020/8/7
王妍0428,"交通：只适合自己开车去周围全是相似的农家乐➕垂钓园只有这家有个比较大的停车场别人家的车都停在路边上了特色体验：钓鱼不管男女老少都可以玩玩我们半个小时左右钓上来两条一条草鱼（3斤）一条鲟鱼农家饭是真香啊烙饼加鸡蛋贼棒！电话及时接听非常🉑️					",2020/8/3
_SuperMona_,"好久不来这边钓鱼了，甚是想念这边烤鱼的味道。这边环境越来越好了，鱼池和吃饭的地方是分开的，旁边还能爬山，中间有个大鱼塘，是老板养鱼苗的地方，老板家还有好多小动物，小孩子可以来喂兔子，非常不错，吃饭环境还算干净，下次再来					",2020/8/2
qubing126,"周末带着一家老小去休闲的，玩得都很满意，可以钓鱼，有好几个池塘，池塘里有不同品种的鱼，鱼竿渔具鱼食都是免费的，娃们钓了半天结果鱼一条也不上钩，只好捞了两条鱼中午吃。还有小动物可以喂食，有小羊、有猴子，土拨鼠，豪猪还有兔子和猫咪，下次还可以来玩					",2020/7/31
nowadays,"20200726上一刻塘里下一秒桌上收获五条战绩(2鲟鱼3鲫鱼)本日最佳>>老妈3条垂钓园钓上来直接后厨加工，还可以撸猫、兔、猴子、豪猪…带娃休闲绝佳之地鱼按品种分的鱼塘想钓哪个就去哪个坑里就行鲟鱼比较容易上钩老妈每次都钓到很多罗非鱼一上午没上钩一条价格上南观村统一售价图片里有鲟鱼价格最高48/斤草鱼鲫鱼啥的便宜很多各种鱼钓上来都可以给后厨加工加工费20餐厅各种农家菜可以点餐还有烧烤					",2020/7/27
艾璇小七,"这疫情哪也去不了，来南观吃鱼吧，门脸很有，里面别有洞天，有山有水有菜地，还有小动物，孩子玩没有问题，农家菜的菜量很大，十个人吃的挺好也没剩下，附近也有湿地公园，吃完可以溜达一圈，房山一日游很完美，下次还会去					",2020/7/26
嘟嘟妈,"带着一家老小来南观钓鱼。进了村，选择了双新垂钓园。就因为他家养了好多的小动物，孔雀，猴子，兔子，小猪，鸡，鸭，羊等等。孩子很喜欢喂养小动物。鱼池也很多，不同的品种，鲤鱼，鲫鱼，草鱼，鲢鱼，虹鳟，鲟鱼等等。现煮现吃，美味不留失！					",2020/7/24
弹头,老板态度极差而且极其势利眼，消费三四百的对你爱答不理，人家消费几千块的像伺候爷爷一样。而且环节极差，苍蝇满天飞赶都赶不走。也就来这一次，下次肯定不会再来了不推荐,2020/7/23
tutujin,真心不推荐太脏服务也差不知道好评那么多怎么来的,2020/7/23
chanel_juan,从家里过去很方便，路程十几分钟就到了，总体设施还算干净，里面有一些动物，还有一只豪猪，可以带幼龄小娃娃看一看。吃的烤金鳟，味道不错。,2020/7/17
小雪人,还不错，人生第一次感受到鱼上钩的喜悦哈哈！话说炸鲫鱼真的超级酥脆，鱼刺都能卡查查嚼了小动物们真可爱，还有只特别会营业的小狗没出镜豹猫很漂亮～豪猪比较少见，老板看来很土豪,2020/7/8
Z小雪,就是方方方方非常非常好了！特别说下水煮鱼超好吃啊！,2020/7/7
天天妈妈811,几乎每年都来的，吃吃饭聊聊天钓钓鱼，很惬意的地方，喜欢他家的酱烧鲟鱼，每种鱼都有不同做法但几乎每桌必点鲟鱼和虹鳟，个人觉得比怀柔的虹鳟鱼农家院价格上要便宜些，是个休闲的好地方！,2020/6/29
小鱼,"位置跟导航没有错很好找，停车也很方便。今天北京疫情防控又开始，我们进村会进行询问从那过来估计新发地没戏进不了村。他们查小区出入证。双新跟有名的一亭一筑离的很近，对面还有个垂钓园。双新山下钓鱼上山吃饭拿到鱼牌才能点菜，如果不吃鱼就不用。🐟：青鱼，回鱼，草鱼，鲫鱼好几种。可以钓鱼也可以让人家捞。我们要了两条一个烤，鲟鱼酱香。本人喜欢酱香有点咸但是鱼先炸了，所有外焦里嫩好吃。吃完饭可以往前走爬山，也可以去红领巾公园导航开车10分钟很漂亮。					",2020/6/16
哦柠檬,"位于房山区的吃鱼好地方，因疫情可能关闭有段日子了，看网上说已经开门营业，就趁周末过来尝尝。特色体验：这家餐厅很大，进去右手边就是垂钓园，可以自己钓鱼。看着一池的鱼儿居然没有想象中那么容易上钩，八成早就对鱼饵不感兴趣了。好在朋友钓起一条鲟鱼，让店家给捞了一条金鳟鱼。顺山而上选择个可以看风景的桌子坐下，把鲟鱼红烧，金鳟鱼两吃，没敢吃生的。整体味道还好，就是正常的农家口味，性价比中等吧。推荐理由：门口有个很大的停车场，位置在村子核心区域。可以坐在小山上看风景落日余晖。					",2020/6/13
贪吃蛇的小确幸,"找个周末出来玩，先钓鱼。鱼塘有很多。有回鱼，草鱼，鲤鱼，回鱼各种鱼塘，想吃哪种鱼就去哪个鱼塘钓鱼。钓上来按斤收费。有几种做法。下面是餐厅。依山傍水的，环境不错，餐厅里也有农家菜。我们钓上来的鱼比较多，就只点了两个凉菜。主要吃鱼。味道不错。环境不错，还有各种小动物，小兔子🐰，小猫咪🐱，小龙猫。超级可爱！强烈推荐！					",2020/6/13
甜心吃货123,"几年前怀孕那会特别想吃鱼，好朋友就带我来这里。吃了好多种做法的鱼。最爱还是炸鱼啊环境挺好的。我们没钓鱼，直接吃的。就是吃个新鲜了价格也挺美丽的景色很好，我们去的时候疫情期间也没什么人，门口有点小猴子和小兔子还有小猫孩子很喜欢					",2020/6/13
