用户名,评论,评论时间
dandan002,"周末人真多，停车场两个都停满了。有好多小动物，猴子，兔子，豪猪，狗，猫。。。不过都在笼子里。猴子最有趣，自娱自乐，各种玩耍。记得以前还有羊和龙猫，这次都没有了。我们钓了一条6斤半的大鲤鱼。是园里的鱼王感觉鲟鱼最好钓，还贵，但是不好咋好吃，有土腥味。鲤鱼两吃，一半垮炖，一半水煮。水煮也不辣，就是咸。垮炖是用豆腐，这个不咸。烤虹鳟鱼，没什么刺，孩子可以吃。					",2020/6/11
淡蓝色的鱼儿,"周末太阳暴晒，但是也按耐不住钓鱼的心情，说走就走，按照导航很好找，青龙湖方向，11点左右到的，人已经很多了，有免费停车场，但是可能去的太晚了，鱼已经吃的差不多了，半天都没钓上来，鮰鱼和鲟鱼的鱼坑很好钓，几乎伸竿就周鱼，鲫鱼很难钓上来，鲤鱼草鱼一般般，因为有点晒，爸爸们在钓鱼，妈妈们带着小朋友们去喂兔子，他家还有好多猫，猴子等小动物。我都后来钓上来了鲤鱼，16一斤，加工费20，往上走就是餐厅，直接加工，说实话很农家饭，味道一般吧，不过小朋友们还是很喜欢的。					",2020/6/10
保密,"双薪垂钓园是同事的推荐，已经多次来，垂钓后直接可以在店里吃饭，新鲜，鱼的种类不同吃法也不同，店里在墙上贴着说明，可以参考选择，非常好！今天鱼不好钓，上午半天就钓了四条小鲫鱼，只好让人捞两条虹鳟，一条生鱼片，一条烧烤！					",2020/6/8
匿名用户,"在疫情防控常态化的现在，给店里打了好几个电话，中午开张了。来钓鱼烤鱼的人自然不少。点了老几样，另外点了一份干炸小河虾。烤虹鳟稍微有点腥，里边没咋入味，家常豆腐有点惨白，回锅加了点老抽还不错。小河虾太潮了，吃着不脆。不像当时复炸过。					",2020/6/1
宗,"首先已经营业了，村口会有拦，提店名即可进入，鱼竿也不收费，免费用，是个农家乐形式的大院子，整个村子除了这家还有很多。双新这家院里面有猴/狗/猫/兔/带刺的**等等动物，小鱼池子4-5个吧够消磨时间，红鳟鱼36/斤，烧烤加工费20元/条，没有什么太多玩的，来的都是回头客用餐，可以坐外面，桌子挺多。					",2020/6/1
1楚风1,"很棒的一家垂钓园，依山傍水，环境非常好有鲤鱼、鲫鱼、草鱼、鲟鱼店家提供了钓鱼竿、鱼食钓完鱼承重付钱，品种不同价格不同可打包带走、可店家给做堂食这家有很多小动物，豪猪、小兔子、猫咪、小猴子很有特色的一家店					",2020/5/30
火爆猴_6779,"15号打电话说开门经营了，16号就过来了，环境挺好的，钓了一条草鱼、三条鲫鱼，因为俩人够吃了就去加工，草鱼做酱焖，鲫鱼干炸，还点了地三鲜、摊鸡蛋，鱼上来了草鱼齁咸，根本就没法吃，干炸鲫鱼也一般，地三鲜味道还不错，不过有个地儿玩儿不错了					",2020/5/25
zyn,"依山傍水，环境不错，钓鱼在山下，餐厅在山上（几分钟）因为疫情，好久没在外面吃饭了，因为第一天开张，没有进货虹鳟，就吃了夸炖鲤鱼，鲤鱼皮毛金黄，应该不是市场常见的那种，口感肉质细腻，没有土腥味，加入豆腐（豆腐赞）、粉条更好吃，还推荐炸河虾、摊鸡蛋……味道都不错					",2020/5/24
匿名用户,环境比较好，可玩儿的东西比较多，价格也不贵，很满意比较推荐了。,2020/5/23
bjw365,想体验的是最淳朴的农家院，想感受的是最浓厚的文化氛围，想放松的是最紧绷的心情，带着美好的心情去吃饭，但是这个店家这服务态度，可真心是不敢恭维，有一种穷山恶水出刁民的感觉，特别强硬！欺生！这次体验极差！,2020/5/18
匿名用户,这个鱼池还是挺划算的，价格也合理。鱼的质量也不错。好评，推荐！,2020/4/11
匿名用户,"小时候爸爸带着来过，那会儿就是拿跟杆子随便钓。国庆期间自己开车带父母过来看看，和20年前大变样了！除了价格涨了以外，增加了吃饭的农家乐，其他没啥变化。不过说实话菜做的真不错，鱼非常入味，烤虹鳟鱼也是外焦里嫩，推荐再来？					",2019/12/1
探路者SAUE,"有小猴子小兔子🐰小鸟和猫咪之类的小动物比较适合带宝宝玩之前我老公和他的朋友一起来钓鱼🎣然后做了吃的……觉得可以垂钓钓完直接做了吃还挺好玩的一个农家乐周末人也比较多我们去的时候赶上了高峰期人比较多服务员有点不够用不过总体还不错					",2019/11/5
_ZZZero,"周日去游玩隔壁不远地方钓的虾，没上钩，到这边看看钓鱼，也不行，天冷了，鱼已经都不咬钩了，地方挺大的，有猴子豪猪兔子龙猫等各种小动物，吃饭在院子里的最高处，风景还可以挨着大山，很舒服，饭菜比较可口，土豆丝。一锅出，土鸡都很好吃，下次还能来，不错的休闲钓鱼小院！					",2019/10/28
北京边少¥,"通过同事介绍听说了这里，但是一直没有机会来，因为孩子喜欢钓鱼，所以深秋时节带孩子去山里玩耍的时候一下子想到了这儿，路程不是特别遥远！据说南观村入选了北京最美村庄，白天来的时候环境确实比较舒适！孩子挺喜欢这里的，一进来，有一些猫猫，猴子，兔子，豪猪一类的动物，不过他比较大了，这些东西貌似不太吸引他，直奔主题，天有些凉了，鱼不太好上钩，我说索性咱们捞两条一吃，得了，他说不行，那样没有成就感，好，那就拿出耐心继续加油，第一条鱼就这样上钩了，因为鱼钩有问题，后来竟然脱钩5次，孩子没有灰心，换了一个鱼钩，很快，又钓上来一条大鱼，完美收官，总算收获不小！宝宝真棒！					",2019/10/27
Z家大喵,"周末和家人去的！真不错！有小动物！钓鱼！吃了全鱼宴！好吃！下次还会来！天暖和再去！周末和家人去的！真不错！有小动物！钓鱼！吃了全鱼宴！好吃！下次还会来！天暖和再去！周末和家人去的！真不错！有小动物！钓鱼！吃了全鱼宴！好吃！下次还会来！天暖和再去！					",2019/10/27
lxj,"上次去感觉还可以，这次去一进门太臭了，小动物的粪便味儿散发的太臭，还有蚊子苍蝇也特别多，上去吃饭到处都是苍蝇飞还有灭蚊子药的味道，点了烤红鳟酱焖熏鱼炸鲫鱼除了咸一点都不好吃，白糟蹋那么好的东西，菜单菜类很少，不推荐。					",2019/10/23
脚尖下的中国,"几个小伙伴约着去吃饭想来想去还是选择了南观离家近还可以吃吃喝喝玩一玩十一点左右到的地方因为朋友家有小孩子就选了双新有各种小动物可以看大人们钓鱼小孩子们看小动物喂蔬菜🥕开心的不得了我们选了虹鳟烤鱼生吃两种鲟鱼清蒸炸了鲫鱼还怪味了一条青鱼还点了几个青菜地三鲜味道还不错其他的菜就很家常菜咯别的环境很好但是吃饭环境就差了一点点不是很干净感觉有点像那种跟着旅行社出去玩那种吃桌餐的地方不过整体还是不错的起码小孩子们玩的很高兴					",2019/10/16
谁还不是小公主,"朋友推荐过来的，说南观村入选了北京美丽乡村，所以我们十一过来了一趟。走到这里，就很堵车。干脆把车子停在一边的停车场里。门口看着不大，但是里面很深，范围比想象中大很多呢。这里有🐵、🐰、🐱和豪猪，不过都关在笼子里面，看着有点儿可怜😣还有金鱼和养鱼池，可以垂钓。我们今天钓了一条青玉，一条鲟鱼，一个红烧，一个做了水煮鱼片。味道都还不错。其他还点了小河虾，花椒芽，豆腐，地三鲜，南瓜，大拌菜和葱花饼。我们自己带了寿司，🍙和水果。最后结账515元。性价比还是很好的					",2019/10/7
Gean_liu,"可以体验钓鱼，而且是免费的，还是很不错的。坑里的鱼都很精了根本不上钩，偶然钓上来的鱼都是钩在了尾巴上或者鱼鳍上面。但是依然很开心。点了清蒸鲟鱼，鱼还是很新鲜的，但是做的口味一般啊，不算美味。煎的土鸡蛋很好吃，葱花饼味道也不错。					",2019/10/2
幸福_966689,"人挺多，有小动物，但是味道很大，管理有点混乱，鱼不太好钓烤串好像不是羊肉，是猪肉，是红色的干煸豆角，皮蛋豆腐，地三鲜，水煮鱼的味道还行，炸鲫鱼挺糊弄，直接把整条鱼弄进去了下次可能不会再来这了，汤也少价格还可以，不是很贵					",2019/9/27
饕餮,"中秋节我们来到地里体验了一下种菜，割韭菜的辛苦，我们割完韭菜就累的腰酸背痛，腿抽筋了。别说包饺子吃了，回来就躺下了，自己家种的韭菜就是干，混好的馅不会出汤，很远就能问到韭菜的香味，就是太细，韭菜和草混在一起，摘的时候很费劲。					",2019/9/25
Femmefatale瑶瑶,"位置不错离着城里不远南观儿这边垂钓园不少我最推荐的还是双新和飞达双新这边有点儿小动物飞达那边做菜味儿好要带着孩子来双新这边能喂喂兔子猴猴真骚呀这次去还看见了豪猪够刺激的和钢背兽还真像鱼还算好钓钓不上来就捞					",2019/9/17
春暖99,可以钓鱼还可以爬山。天凉了，鱼不上钩，只能拿网捞了,2019/9/14
推车的老汉,脏脏脏，除了脏，记不住别的。那些说卫生好的，是不是天天在厕所吃饭！到处蚊子苍蝇，座椅肮脏，桌子油腻，饭菜恶心。,2019/9/2
dpuser_11929332025,总体来说还不错，自己钓鱼，然后到厨房加工，价格也很合理，里面还有小动物，很适合带孩子去,2019/8/26
疯狂的娃妈p,"7岁的孩子特别爱来这里，第一次来的时候，娃自己钓了3条鱼，特有成就感。此后就多次念叨要过来，今天天气很好就过来玩了。一进门有很多小动物，猴子，豪猪，猫咪，兔子，金鱼，鹦鹉等。我觉得这里适合一家老小过来的原因也是孩子们喜欢小动物。言归正传，鱼坑有10个左右，各种鱼，坑边有注明。每个人都可以拿杆钓鱼，可以感受一下。不过今天好像都不好上杆，不吃食。没等钓上来我就捞了一条虹鳟鱼烤着了，还点了怪味鱼，鱼点多了，又点了土豆牛肉，松仁玉米。最后娃爸和娃钓了2条草鱼，外加两大瓶饮料，一共是433元。					",2019/8/24
小红阿小红,"在房山很有名的吃鱼的地方，这次来赶上周末了，人真不少。他们家特色就是旁边有鱼池，可以吃自己钓上来的鱼，我钓了半天都没钓上来！！鱼的种类不少，做法也挺多的，推荐怪味，其他地方吃不到。野菜也好吃，最喜欢木兰牙啦！不过感受不好的是店家为了博眼球关了好几只小猫龙猫居然还有猴子……小动物们生活在并不干净的牢笼中看着真是可怜。虽然房山吃鱼肯定比怀柔便宜些，但也不便宜，人均100-150。					",2019/8/22
梦音儿,"经常会驱车来这里玩耍，门口有免费停车的停车场，吃饭垂钓🎣。[特色体验]养了很多可爱的小动物，猴子🐒最早之前一家三口今年母猴子🐒生了一个小女🐒一家四口、🐒姐姐总是欺负妹妹。之前没有➕外圈的一圈护栏因为小猴子太顽皮，这次去加了护栏。豪猪，浑身散发着臭气熏天。小兔兔有白色灰色很多只。这里吃饭垂钓还可以喂小动物，这不是一家不错的生态园。					",2019/8/19
小欠猫,"正好去房山爬山，然后因为之前朋友推荐说这里的烤虹鳟鱼很棒，所以导航就过来了。一进门就被门口的小动物吸引了，有猴子，还有小猫。小猫咪真是很可爱啊，蓝猫，豹猫都有。老板很热情的问我们吃什么鱼，还问要不要自己钓鱼，可以自己烤钓上来的。我们因为爬山太累了，还是想早点吃上，所以就直接让老板捞了一条鱼，两斤多。然后顺着小亭子上山，到了里面，可以说这片环境挺好，菜都是很家常的。点了一个炸香椿苗，上面的糊裹的不太好，不脆。平锅茄子特别好吃，溜豆腐就是普通的家常豆腐，韭菜炒窝头就是油太大了。最后是烤好的虹鳟鱼，真是太鲜美了，好吃！					",2019/8/18
可乐爱柠檬宝宝liy,"【环境】下面钓鱼，上面吃饭，环境干净，水是活水，没有异味，去的时候下着小雨，环境很是惬意，对了，还养着小动物、还有个会说话的八哥！【服务】服务也不错，热情实在，鱼上钩了，立刻有人帮着捞上来。【餐饮】鱼可以选择带走或者付点加工费在这里加工，做了一条罗非鱼，几条干炸鲫鱼，干炸鲫鱼有点炸过头了，吃不出鱼的味道了，总体来说钓鱼的体验优于餐椅。					",2019/8/17
600go,"老父亲喜欢垂钓，在网上看了点评从城里开车过来的。讲真，这并不是一家正了八经的垂钓园，而是一家农家乐，钓鱼只是为了给餐桌上增加一道菜而已。鱼的种类很多，鲟鱼鳟鱼罗飞草鱼鲤鱼鮰鱼，鱼塘水很浑浊，钓上来就给你做（单加二三十的加工费）钓不上来，可以工作人员给你抄！至于菜品吗，味道真的太一般，无可口而言，只是能吃饱而已，比怀柔那边儿的农家乐味道差远了！菜团子千万不要点，6元一个，皮儿非常硬，馅儿也不是新鲜的野菜，黑乎乎的感觉像梅干菜！点评中好多人都说一进门有很多小动物，其实就几种，豪猪、猴子、兔子、龙猫、猫，都锁在笼子里，脏兮兮臭乎乎，周围好多苍蝇！总体感觉，店家有想法，但每一方面做的都不精致，不会再来！					",2019/8/16
椰子汁_6549,菜量挺大，价格适中。吃完还能钓钓鱼,2019/8/12
Cookie__XuE,超实惠，量大，服务态度热情，自己钓上来的鱼，做着吃，新鲜好吃，,2019/8/6
匿名用户,自己钓的吃着香哈哈好多种做法其他菜的味道也不错量也可以院里还养着好多小动物挺有意思,2019/8/3
匿名用户,到处是蚊子，闺女被咬的乱七八糟，味道一般，价格还行，服务员都很懒，结帐时注意，有时多收钱,2019/8/1
豆豆和猪猪,真心的不推荐，饭菜难吃的要命！！！红烧鱼都吃出了骚味！！！炒菜用的油绝对不地道！！！,2019/7/29
wangyuqinge6,会钓鱼的朋友可千万别来，这里只能哄孩子。池水又绿又肥，主人提供的鱼竿只能说比扁担强点，线打卷，没有铅坠，连孩子都不用它。,2019/7/27
ymjmm,京郊农村的变化，绿水青山就是金山银山-……,2019/7/21
吃不胖是假的,虽然面积不算大，有几个小池塘，但是他家比较全，有猫，猴子。兔子，鸟呀等等一些小动物，孩子喜欢，饭嘛，中规中矩，周末经常会带孩子去玩一会,2019/7/18
基层中的小星星,胆小的我被🐒吓到了～双薪环境真好！风景如画、门口停车，老板和我妈聊的还挺嗨…………,2019/7/13
无敌吃货椰_,"周末带孩子出游，选择了房山区的美丽乡村，南观村带着孩子钓鱼🎣➕吃饭，真是好去处，环境很优美，天气清爽，万里无云，在山脚下看向远方，真的心旷神怡这次选择了鲫鱼双吃，干炸和酱闷都非常好吃，酱闷老人孩子都可以吃，干炸吃起来酥脆可口。园里有小动物可以参观，小朋友很喜欢。					",2019/7/11
爱吃的熊宝宝ZT,"想吃鱼可是怀柔远了点，看点评发现房山南观村全村搞垂钓，于是过来一探究竟哈哈！离城区45公里，京港澳高速下来开10公里左右到达。鱼的价格比较统一也透明，鲟鱼、虹鳟鱼、青鱼、罗非鱼、鲫鱼、鲤鱼、草鱼等等品种不少。经过实践鲤鱼草鱼罗非鱼都比较好上钩，虹鳟钓起来真是难啊钓了一条鲤鱼三斤多，16元一斤，水煮做法加工费25元。额外点了地三鲜、麻婆豆腐和炸小河虾。水煮鱼的油肯定是反复利用的，本来白白的鱼弄的很黑，影响了食欲。宁可收费高一点用新油比较好。其他菜品也是一般般啦如果不嫌远吃鱼还是要去怀柔。					",2019/7/7
玉玉的庆庆,"环境：垂钓园面积很大，但是室外就餐苍蝇太多，非常影响食欲口味：鱼🐟是真心的新鲜，杀死的瞬间都有罪恶的感觉，但是做出来的口感却不太好，过量的调味料和重油完全品尝不出新鲜的味道了！服务：服务还不错！					",2019/6/30
elanhui,"这怀孕了也不知道想吃点啥，琢磨半天，老公还是带我来吃鱼了。这里的鱼都是现捞的，最喜欢干烧鱼，所以这次又点了干烧鱼，好像是草鱼吧还是鲤鱼我也忘了。就是这上菜速度真是不敢恭维，俩人点了个凉菜，北冰洋，还有个烧茄子，等到我俩凉菜和茄子都快吃光了鱼也没上来。等得我花儿都谢了。哎真是捉急。					",2019/6/29
xulifu989,"三四年前朋友带我们去过一次，感觉很适合带孩子去。结果清明节去时候就没排上队，今天休息约上好友一起拔草。上午先带孩子去南宫温泉，下午直接过去垂钓，这里不要垂钓费，只用买鱼就好。我们开始想钓鮰鱼，估计里面鱼太少，半小时都没上来，孩子们看着别人的成果羡慕嫉妒，就都去钓鲫鱼，鲫鱼好上钩，几分钟就一条。我钓鲟鱼，脱钩两次后第三次上钩一条4.3斤的，收货满满的就去山上的餐厅等餐了。店里的菜上菜巨快，五分钟几乎全来了，孩子爱吃饸饹面，又香又滑，农家豆腐很嫩，一锅出的饼子也很香，棒子面的。炸鲫鱼也是又香又脆，椒盐特别给力，以后只要有空还会再去。院子里的鸡冠花也被我玩儿坏了一朵，给孩子们玩儿我们小时候的游戏。					",2019/6/23
T毛毛,"南观已经把垂钓和餐饮相结合做成了一个品牌，每到节假日这里的垂钓园都比较火爆，需要等位。我对垂钓没什么兴趣，但还是很喜欢吃鱼的，在这里钓的鱼可以根据自己口味要求烤、炖、红烧等好多种做法，总体评价味道很棒，下次敢人少时去。					",2019/6/15
边走边尝_2728,"地标：房山区南贯村，这里曾被评为北京最美乡村环境：这里很大，包含鱼塘、还有猴子🐒、火鸡🦃️和很多猫咪🐱，不过动物多了再加上天气热，所以苍蝇也很多，其实还是比较影响就餐的服务：这里人都很淳朴，没有什么标准化的服务体系，就是客气、真诚性价比：如果全天垂钓🎣加吃饭还是可以的					",2019/6/14
*April10th*,"单位同事一块组织的烧烤行动，自己带烤炉和肉串，9点半多到的垂钓园车位挺多一路上都是垂钓园可能越往上走水相对更清一点吧我们提前打电话预约了地方但还是先到先挑地方幸好来得早选了个位置比较高的地方。进门门口有猴子一家三口豪猪一家三口几只兔子几只猫都是在笼子里的。钓鱼的水比较浑浊鱼竿在旁边可以自己拿使用不收费由于鱼竿不收费有很多竿都坏了钓上来的鱼旁边有价目表可以直接带走也可以让他加工味道还不错到没有说特别好吃因为主力还是烧烤楼梯上去可以爬山但我们也没上去光烧烤就吃了34个小时总体来说还不错水能在清点就完美了					",2019/6/10
蘭之舍,"南观村钓鱼吃鱼农家乐已成规模，我准备一家一家都去尝尝之前已经去过写过两家，今天来写双新～它家对面有停车场，非周末停车非常方便～一进门有喵星人，可能天气热，个个都懒洋洋的，还有豪猪，猴子🐒，小孩子比较喜欢～露天鱼池有点晒啊，钓了二十分钟鲟鱼不见上，就在失望的喊大叔捞鱼时钓上来一条～清蒸鲟鱼的味道令人失望，跟我自己在家做的水平差不多，蒸过头了，而且有土腥味～					",2019/6/8
吃成皇驴晴蓝籽,"朋友推荐的这里，赶在去年十一假期的最后一天来的，一路上风景还不错，到了这里停车也很方便，里面像是个小公园，特别适合踏青遛娃，还有很多小动物呢！钓鱼🎣玩了会儿还真钓上来一条，超级小的鱼，后来又给扔回去了，吃的话还是找师傅直接捞上来的，最后选了两种鱼，鲟鱼清蒸鳟鱼烤着吃！其实还是烤鱼比较好吃，完全吃不出腥味！其他的几个菜也是典型的农家菜，菜量大味道不错！					",2019/6/7
吃成了胖子,闲暇之日来郊游啦～有山有水风景很不错～还可以自己🎣,2019/6/6
tta...,鱼的种类很多味道做的也是很好吃菜量很大这里还能供人们垂钓还有供小孩子观赏的一些小动物位置很好找,2019/5/27
蓉蓉_5196,在这家吃了几年了，一直都很好菜味做的也很不不错！孩子又喜欢在这钓鱼🎣玩！园子里还有很多小动物，大人钓鱼小朋友喂兔子！环境很好！,2019/5/19
糖糖,看着不错哦。有机会去玩玩。都有些什么玩的啊？,2019/5/17
魔幻小悠,这个地方烧烤真不错，自己带食材，给点场地费就可以了，然后再点些餐厅的菜，简直不要太完美，还有好多的小动物，溜娃非常棒，而且路非常好走不堵车,2019/5/13
豆豆是条狗,"一颗星都不想给！！！服务态度太次，收拾个桌子从那摔来摔去，点餐叫半天都没人好不容易来一个，来一个还跟吃了枪药一样…………结账的人耷拉个脸子给谁看呢？？？跟谁欠你五百万一样？？？要不是带着亲戚朋友来的早摔桌子走人了🌚					",2019/5/9
小妮子么么么,"来过很多次了门口有免费的停车空地进门右手边是各种不同的鱼池钓完在门口师傅给称重自己选做法钓不上来也可以临时现捞最后会给个号码牌门口的左侧和鱼池旁养着很多小动物这是最吸引小朋友的地方……上楼梯到顶上就是吃饭的方把号码牌给服务员再点上几道菜就可以等着开饭了环境来说农家院的风格桌椅板凳比较陈旧有点脏了菜的味道也是属于一般般的但是个人觉得水煮鱼还是比较好吃总体来说值得带小朋友来玩半天五一的时候人真的很多……					",2019/5/5
小圆脸,"时常来南观钓鱼，因为是活水，所以鱼很新鲜，没有土腥味儿。但我们基本上认准一家就懒得换了，之前在比较靠前的一家，后来发现这家有小动物，就改在这家了。这家环境比较好，称鱼分量足，管理的要好一些，而且推荐水煮鱼，做的特别特别好吃，烤虹鳟也不错，糖醋鱼要是能改松鼠鱼就更好了。老板确实不够热情，人也比较多，但总体还是很好的，推荐。					",2019/5/2
dpuser_0752285850,"以后再也不会去了，我们是过完清明假去的，是老客户了，所以带亲戚朋友直接去的这家，本来挺好的心情，不知道这家老板娘是出门没吃药还是出门药吃多了，说话跟审犯人似的，问谁让我们烤串的，以后不许烤，我就想说了，我不是没交烤串的卫生费，不能烤我们就不来了呗，该你的欠你的，要听你跟三孙子一样训，再说一直都可以烤串，你临时说还这个态度，让我们当时很尴尬，又不是只有你一家，做生意怎么能这个态度，态度太差了，再说吃的，鱼根本钓不上来，不吃食，只能捞，完全没钓鱼的乐趣，而且鱼还烤糊了，凉菜蘸酱菜，那黄瓜都是冰箱拿出来的，不新鲜还冰凉，比以前差远了，那天大家都没玩好，也没吃好太失望了，朋友也说告诉亲戚朋友以后别来了，不咋样					",2019/5/2
飞天枕头,"分享一下哈，喜欢钓鱼的小伙伴和小小伙伴可以参考前往房山南观村，号称“小十渡”，整个村子以“吃自己钓的鱼”为特色，各种垂钓园，零基础垂钓成功率极高全村的鱼由村委会统一定价，就看你喜欢去哪家了，基本上都是垂钓、农家菜、爬山、看小动物这个模式，路不远，周末可以耍一耍					",2019/5/2
哟哟来也,"离房山大美很近，我们玩回来去吃的，园子挺大的有湖，马路对面就是免费停车场，还有充电桩！鱼可以钓可以捞，按鱼算钱，每种鱼的做法都写有单子非常好！价位适中！我们四个大人两个小孩，点了一条不到两斤的鱼，其他水煮肉什么的菜不到三百！园子里有猴子，豪猪，龙猫，猫，兔子这些小动物，小孩子很喜欢看！还可以烧烤，所有的东西自带，包括炉子，租一个地方50！					",2019/5/1
SarahZ,"之前想吃烤鱼，在南观这条路一直找，看到这家，人均消费可以接受。店对面就是一个免费停车场，停车比较方便还有充电桩。饭点环境是个亮点，像是一个私人公园，里边有各种小东西，骚骚的豪猪，猴子一家。进门可以选择钓鱼或者让员工帮你捞，烤虹鳟味道非常好，推荐饸饹面。					",2019/4/30
supper大妈,人特别多，环境也一般，不是很建议去玩，也不方便停车,2019/4/18
