用户名,评论,评论时间
wudi9119,"环境非常好，人也非常多，里面还有孩子在玩的地方钓鱼，棚子非常多，有茄子，辣椒，还有西红柿，不过周六下午去的，青菜已经没有熟的菜了，说下个星期去可以摘，西瓜非常多非常甜摘了6个西瓜，一斤5元一斤，当时就吃了一个。					",2020/5/28
forpei,"看着点评可以摘西瓜了从几家高分的选择了这家周六中午12点到的人还是不少很多车都在他家这看来点评的影响力很大西瓜🍉现在是5块摘了6个145挺合适的高速下来后路边也有卖的便宜5毛4.5一斤还有不是树上挂的在地上的西瓜4块一斤都差不多					",2020/5/27
雅雅,"今日周一去的，经过一个周末成熟的西瓜蔬菜快被摘光了哈哈，但是今天人很少：）老板服务很好，蔬菜水果价格合理，采摘过程很有趣，园内十分干净，还会再来。满分推荐！还有四只可爱的小兔子，西瓜回家切开也很甜～好吃					",2020/5/23
sun192,"五一期间来过一次，女老板很实在，明确告知西瓜瓤还没有完全变红，如果想尝鲜的话可以摘一两个，我们摘了两个，瓜瓤粉红但很甜。这周又来了，赶上了采摘团队，人超多，本周瓜已完全成熟，超甜超好吃，6元一斤，一个小西瓜4斤左右。孩子们可以在门口喂可爱的兔子🐰					",2020/5/23
dpuser_8151117782,"大众点评上看到的！孩子一直想要摘🍉！打电话咨询，老板很亲切。地方很好找，人也不少，老板亲切的给我们讲解如何摘瓜。除了瓜，还有好多蔬菜，但是熟的都给摘了，好多好多都没熟！哈哈，期待下次再去。结完账，老板家还有礼盒，当场切开一个，哇塞！！！！超级甜！瞬间就吃完了！非常满意！加了老板微信，说是随时可以快递！还会再去！					",2020/5/21
qianqing123,服务周到西瓜口感最好水分足甜度高脆沙的感觉！,2020/5/20
CandyRain,西瓜真的……甜过初恋还可以让超负责的老板娘代发快递山东次日达上海隔日达明年还会去,2020/5/19
dpuser_8003093601,带孩子去的，店家很亲切，西瓜六块性价比不错，蔬菜什么的味道很好，有小时候的味道，类似超市的精品无公害蔬菜，六月份还回去采摘羊角蜜,2020/5/18
ceruleanly,西瓜🍉好甜呀成熟可以采摘的西瓜老板都系了红绳这样小朋友也能轻松辨认好办法,2020/5/17
豆芽小雯,老板家地种的太棒啦！品种超级多，真讲究，价格还实惠，一年四季都有东西，以后可以常来啦,2020/5/17
仨麽麻麻爱夏天,采摘的人真多，刚开了新棚，第一茬西瓜可以采摘了，西瓜挺甜，6块一斤，停车方便，服务热情。周末来很多菜都没成熟，还得再等等，老板说周四，周五来最合适。,2020/5/17
wf5257,"老板挺热情的，人不少，西瓜棚很多目前开放了两个，应该是五一被洗劫过现在熟的可摘的并不多，据说下个星期开始有机菜就该熟了，听说庞各庄政府免费给发有机肥，所以不用担心会有化肥的蔬菜，过些天再来。西瓜六块一斤，菜八块一斤					",2020/5/16
小草西_4608,"提前打电话问老板可以去采摘西瓜，开车过去40分钟，摘了西瓜和西红柿。两个棚子是西瓜，上面有不同颜色的绳绑着，蓝色和黄色的可以采摘。孩子很高兴，还摘了西红柿，挑红的老板还摘了一个切开让客人们尝一下，好甜又好吃。真是不错，庞各庄西瓜名不虚传。					",2020/5/16
peri盈,"朋友的同学在这边做采摘生意，去年就邀请我们来玩，今年终于约了一趴，陪着小朋友采摘的我们，玩得很开心。他家生意非常好，来得晚基本大棚的菜是摘不到了，只能摘上些西红柿，棚里西红柿能有四五个品种，偷吃了几个，看着青，但都熟了，有西红柿味，酸甜口，甜口都有。采摘西瓜是重点，瓜秧上有标签，蓝色黑色标签线的都可以摘，建议自己再轻拍听听声，判断熟度。今天天凉快，我们也算来得是时候，结账完太阳才出来，收拾收拾就能吃午饭去了。					",2020/5/16
图四喜,"按照领导要求，逐个落实采摘园实况园子真多，就属它最特殊。老板是名艺术家，热爱生活，专注细心把农产品做成了艺术品。在那一刻我深深的感受到生活本应该如此绚丽多彩🍉🍅🍆🥒🥦🥕🌶热爱生活的朋友们，赶紧去感受美好一定不虚此行					",2020/5/16
dpuser_9094323082,"u1s1这家农庄不算太大，老板服务很热情，有西瓜西红柿黄瓜和其他几种蔬菜。西瓜非常非常好吃，甜、水分足。黄瓜味道也很浓，很清新。西红柿分品种，有的好吃有的不好吃。老板还养了几只小兔子，摘下来的菜叶可以喂兔子，小朋友很喜欢					",2020/5/16
小喜洋洋,"老板人很好，西瓜🍉和蔬菜都有采摘，但还是有点早，瓜果宝宝还没有完全成熟，西瓜熟的稍微有点少呢，但是连玩再摘也够了，西瓜超级甜，现在的甜度能到13~14的，老板说再过一段口感更棒，五月中旬，五月底就差不多了，推荐！					",2020/5/15
快看这里有好吃的,"一直来他家采摘，每年这时候来摘西瓜回去吃，老板特意从国外学习回来的，还带了一些新的品种，摘西瓜顺便带点菜回去，老板说今年天气原因，西瓜熟的晚，建议大家晚两天过来，今天先少摘掉，下礼拜看看继续过来摘哈哈，不得不说他家西瓜口感真的不错，哈哈😄老板特敞亮，还给优惠了，说因为还没到时候，但是我想问，这要是到时候了你家西瓜得是多甜，赞赞赞！！！					",2020/5/14
marciewang,"第二次来了，去年也是5.1这天来的，被他家西瓜迷住了，今年又是想着这口又过来的哈哈，放假带着家里人跟朋友一起出来感受一下农家的感觉！这老板人可好，特热情，来了先吃瓜品尝，然后老板带着去摘，告诉你哪个口感好，摘了好多菜，还有小柿子，还有西瓜，他家主要是西瓜，别看小柿子是黄的，但是口感超级好，水分还足，老板是专门在国外学的，他家还有一些新的品种。真的是五一放假的好去处，奔着他家西瓜，冲着他家老板					",2020/5/11
诺涵3317,"点评看评价去的，西瓜是真的很好吃，还有西红柿，茄子，青椒等可以摘，去的有点晚西红柿几乎没啥可挑的了，西瓜买了好多带回来，还在旁边摘了好些野菜，婆婆特别高兴，回来以后炒了茄子和青椒，果然跟超市的不一样，特别嫩，羡慕能天天吃到新鲜蔬菜的老板，哈哈，等到了季节再带孩子去摘一次					",2020/5/8
lim0907,"还是天气热的时候去的了，看评价排名第一，直接就按照导航过来了，位置还算好找，不在主路上，要拐进去，去的时候已经有些人了，门口摆着小孩子可以捞鱼的池子，小盆友立马放弃摘西瓜，蹲那玩了起来，棚里当时挺热的，速战速决的摘了不少，味道都不错。					",2020/5/3
刘洪宇,年年在他家采摘，年年特满意！品种多、品质高、服务更好！！！,2020/5/2
陈锐,瓜摘了就可以，很甜！老板一家人很好！价格公道！,2020/5/1
宇宙无敌晶,家住北边，昨天下午去的，老板人特好.园子里有小西瓜和蔬菜，由于去的晚蔬菜已经没有可摘的了，只摘了小西瓜，挖了大葱.西瓜真甜呀！孩子很喜欢这里，过一阵再去.,2020/5/1
唯有美食不可负,老板一家特别好，菜都好吃。摘了西瓜，西红柿，茄子，黄瓜，味道很棒。离得近，准备每周去一次。,2020/1/1
sx14,老板一家都很好瓜很甜价格还不高,2019/12/21
希望会更好_5064,"采摘园离家特别近，建立种植园可接待团体个人前来采摘，设有大型停车场，可以同时停多辆汽车，采摘的枣子均个头特别大，特别甜，成熟的特别好，风景也好。十一带孩子家人一起来的，都特别开心，还有几个小动物，也可以烧烤，喜欢的朋友可以去看看。邻居吃了枣子也说特别甜，特别脆，下次还会去的。					",2019/11/24
果冻86,"朋友推荐的采摘园，在大兴，走大兴机场高速，很快就到了，四周都是这种大棚采摘园，不过这家人最多。现在已经进入深秋，西瓜过了最佳采摘期，蔬菜种类很多，茄子、豆角、黄瓜、萝卜，还有各色小西红柿，随手摘一个都很甜，而且没有农药化肥。基本都是带孩子来的，边玩边摘，推荐！					",2019/10/20
oliverabc_8288,"一大早去采摘，10点多到的。好几个棚，西瓜棚较多，我们摘了小西红柿，黑玉米，西瓜，黑玉米回家煮了特别粘，好吃！西瓜摘了8个。有一个好像没有熟，其余的特别甜。西瓜五元一斤，小西红柿也摘了不少，味儿挺浓的，比市场买的好吃，我们专门从西边过来的，除了有点远，其余都挺好					",2019/10/15
ranran930225,"周末闲来无事突然想摘西瓜，开车就去了，老板领着，手把手交在你们挑西瓜，老爸特别开心，吊秧瓜个头也不大，剪了一个又一个，一个大框子装的满满的这西瓜确实很好吃，够甜水够大，小个儿的一顿能吃俩，也好存放，以后还会去的					",2019/10/8
etphotos,"非常棒的采摘园……老板和善好沟通。西瓜超级好吃，超级甜而且皮薄，这个夏天吃的西瓜基本都是在他家摘的！番茄品种也多，小朋友摘的开心，吃的放心……最喜欢她们家种的白茄子，市面上少见，做茄子煲超级合适，软软糯糯的！					",2019/9/15
特别关注_,"安排名搜索到的，10点到的，已经有很多人了，蔬菜已经被摘的差不多了，黄瓜、茄子、豆角全被摘光了！只剩青椒、西红柿还有一些。采摘一定要早来呀……小吊西瓜不错，还有很多，熟的刚刚好，薄皮、脆甜，小白籽，值得拥有～					",2019/9/13
CancanCandice_8078,"庞各庄西瓜是北京的特产，最正宗的是直接采摘，路边摊不一定是真的，超市里买的真贵，下瓜季节我都会去采摘一次，每年不同采摘园，其瓜的品质都不错，今年按照导航去崔鲜生农庄，也不知道对不对，反正哪里的瓜都是上品，店家留的姓名是崔焕生。希望大家都去。					",2019/9/11
mumunanjsnj,[交通]开车去的很方便[特色体验]很有意思,2019/9/3
磊子_8137,来过好多次，才知道有点评，补签补图哈。今天带娃摘了西瓜，西红柿和花生。绿色的贼不偷可好吃了！,2019/8/24
lillian_1016,西瓜还可以，但是有一点点小小的贵,2019/8/11
边吃变瘦,非常好啊，有个大叔很热情，还有摘草莓的阿姨也很好🏻，带孩子去很不错！,2019/8/11
噔噔噔噔噔噔噔噔噔,西瓜特别甜，而且价格不贵，可以自己到棚里现摘，就是有点远,2019/7/26
AUVH,西瓜非常甜，孩子又体验了自己采摘的乐趣。就是大棚里确实太热了，不能久呆。还有好多菜都没熟没赶上摘，方便的时候还想去。,2019/7/14
dpuser_64433079347,西瓜非常甜，从心里到挨着皮的地方都很甜，年轻夫妇很实在，还给孩子拿了几个特别小的西瓜回家玩,2019/7/5
liuliullll,老板是一对小夫妻，人很好，还会去,2019/7/1
关于闹闹,"点评上廋了一下排名不错开车就来了娃儿们高兴坏了蹦蹦摘了三十来个巨甜！老板娘怀孕了感觉很拼啊有孩子玩的滑梯跷跷板还有小兔子娃儿来了就不愿意走了棚里还有小甜瓜，西红柿，茄子辣椒，我们去的时候西红柿还没怎么熟，扫了一圈捡了十几个，回家做的西红柿鸡蛋孩子特别爱吃，就是小时候吃的味道，能炒烂。整体挺好就是人多					",2019/6/26
wym王丽娜,"开车到了崔鲜生农园，抱着满腔热血，来到了庞各庄，著名的🍉🍉，下了高速，路边全是卖西瓜的，但是品尝了路边的，味道的确不如原来，因为原来经常来这边买西瓜，到了崔鲜，熟了的瓜很少了，摘了一个，当场切开，的确西瓜味不是很浓，而且水分太大了，没有西瓜味道，可能是因为时间不够就采摘了。结束采摘，最好摘了7个西瓜。					",2019/6/25
PX,"我脑公念叨了几个夏天要去庞各庄摘西瓜，不就摘个西瓜嘛，还要跑一百多公里，无感，所有一直没有落实，这次突然开窍了，决定去，不得不说还是很值得，西瓜确实很好吃，是我吃过最好吃的西瓜了，比心心念念的8424还好吃，皮薄肉多，关键还是自己亲手剪下来的，直奔着大兴区采摘农家乐热门榜第一。现摘5元一斤，现买四元一斤，大西瓜三元一斤，还有很多蔬菜也是5-10元一斤。称有一点点问题，比我实际体重多1.5斤。还是可以接受的范围，毕竟种西瓜很辛苦啦，我们在里面摘西瓜一分钟闷的一身汗。一筐瓜两人不到一周吃完了，上周去了这周刚又去了回来。					",2019/6/25
哈呢噜噜,"大兴区西瓜种植以庞各庄地区为中心，庞各庄周边6镇所辖的200多个村庄均以种植西瓜为业，其中以庞各庄西瓜最为著名。大兴每年西瓜种植面积8万亩左右，西瓜总产2.6亿公斤，面积、产量均居京郊各区县之首。长期种植西瓜的历史，形成了大兴独特的西瓜文化。价格略贵。					",2019/6/24
匿名用户,"今天天气还算凉爽开车直奔大兴庞各庄，看点评都推荐崔鲜生，一路导航直奔瓜棚。这家瓜棚不少，也有蔬菜大棚，西红柿黄瓜茄子等，老板家还养了七，八只小兔子，很可爱。下面进入主题。老板说摘西瓜去1,4,6,7号大棚，结果进棚一看都摘的差不多了。瓜秧上的熟瓜个都不大，摘了五个，又去8号大棚摘了五个大点的共10个爪145元钱（每斤5元）称好后取出一个自己摘的瓜，切开一尝还真不错，皮溥瓜甜，瓜皮给小兔子吃。它们高兴的吃起来。老板说。扫一下微信来之前打电话询问一下瓜熟的情况，和蔬菜的成熟情况，以便来时方便采摘。					",2019/6/22
xuming2321,"和儿子一起去庞各庄采摘西瓜，其实就是带孩子玩。搜的大众点评按着导航过去的，采摘的小吊瓜，皮特别的薄，特别甜，还有大的西瓜。价格比别处的采摘园便宜一点，还可以采摘新鲜的蔬菜。黄瓜，西红柿，豆角等。带孩子玩，比较不错的地方。					",2019/6/21
有梦最美_2208,"看了评论过来的，孩子一听要摘西瓜🍉开心的不得了。跟着导航一路到达目的地，很好走。沿路全是瓜棚，还有摆放整齐的摊位，太诱人了。到了地方孩子就把摘瓜忘到了一边，直奔水池捞小鱼去了，所以说孩子的快乐真的太简单了。老板很热情，不过因为我们是下午去的，老板说西虹市🍅熟了的都被摘光了，说可以去看看有没有漏网之鱼，我们拿着袋子溜达了一圈，那真是一片绿啊，想多了。然后跟老板要了篮子🧺和剪刀✂️去摘瓜，叫上孩子，然后小朋友就跟打了鸡血似的，一溜小跑的直奔瓜棚，按照老板说的只能摘蓝色带子绑的，孩子是见一个就想剪一个，还好陪着，不然得买一筐生瓜蛋子。西瓜🍉大小不一，孩子那真是捡大的挑，不过吊秧瓜大也大不到哪儿去，一共摘了9个，130多，不贵，也让孩子感受到了乐趣。包装有塑料袋和纸箱，因为想送朋友几个，要了一个纸箱，一个纸箱能装四个。包装也很好看，原谅我忘拍照了。来这的好处就是孩子可以免费玩儿捞鱼，还可以喂小兔子，不会让孩子觉得闷的慌，所以带着孩子可以选择这里					",2019/6/20
Woodpecker_2104,"休息带妈妈和侄子来体验一下、人很多、西瓜很甜、还摘了些辣椒、朋友还弄了些野菜、还有桑甚、除了西安还有黄瓜、不过还没有大量上市、收获满满、老板人很好、很热情、妈妈高兴就是我最大的心愿、要去的小伙伴抓紧时间哦！					",2019/6/20
超级萌娃小可爱,"相当给力的采摘园！西瓜相当甜！相当甜！老板一家都非常好，非常朴实，善良，有问必答，到了先让你尝西瓜，主动介绍情况让你感到宾至如归的亲切！采摘有西瓜，西红柿，黄瓜，茄子，辣椒等。价格都不贵，西瓜5元一斤，蔬菜好像是8-12元每斤。她家顾客很多，所以瓜果的消耗量也大，建议大家提前打电话问问。强烈推荐！强烈推荐！					",2019/6/19
至尊宝,"周末亲子好时光，朋友团聚好选择，采摘去吖~按着导航过来，挺好找的，主家又幽默又热情，难怪客户那么多呢。我们进棚摘瓜，原以为西瓜是长在地上的，倒也是有地上的品种，这次是摘的藤上的吊瓜，小小的，抱着试试的心态没有摘太多。可是回家之后一吃，又脆又甜，比大西瓜好吃多了，后悔没有多买一些回来。下次还去					",2019/6/17
泰坦萌妈,吃瓜的季节，就得吃点好瓜，自驾走着，往返需6一70公里也直，瓜的确好吃，特点：瓜个子小，脆甜，不错……,2019/6/15
玲儿,还不错，门口还有小孩子玩的几样玩具,2019/6/15
幸福的东,老板很周到，西瓜不错，比周围的便宜一些，养了兔子孩子很喜欢。,2019/6/15
斌啊斌呀,庞各庄崔鮮生农园採摘西瓜，瓜真甜呀。,2019/6/15
iam张小眼,孩子在水边嬉戏！我和孩儿他爹去棚里偷瓜！瓜超甜！吃一口西红柿让我仿佛回到小时候！,2019/6/14
北京博客,"端午小长假过来玩，好多家长带着小朋友过来，园里不光有西瓜，还有黄瓜，西红柿，茄子，辣椒，西葫芦，小兔子，虽然蔬菜都被摘光了，但能带小朋友来看看蔬菜都是怎么长的也很有意义。庞各庄的采摘园都是小西瓜品种，很甜，商家还提供快递服务					",2019/6/14
马马_8097,"在大兴区西瓜小镇～位置按照导航过去还是非常好找的～瓜棚里没有想象中的热～这家是以科学的技术区分西瓜不同程度的甜度～但是不会挑西瓜的还是让老板帮着挑挑吧～自己挑的可能有点生～老板一家也非常好～但是甜瓜还没有成熟～下次要是想采摘蔬菜可能得早点来					",2019/6/14
AppleIris,"点评他家排名第一，的确人也很多，全是人，门口有孩子玩的捞鱼池（假鱼），还有三笼子小兔子，我提前在家准备了胡萝卜条喂兔子，其实不用准备那些兔子都是吃西瓜皮的，他家除了西瓜还有西红柿、黄瓜、茄子等蔬菜！西瓜5元一斤但我尝了下甜度一般也不知道是人多的原因还是什么，所以我只买了黄瓜和西红柿！带孩子想采摘西瓜的话可以去看看！毕竟门口的捞鱼池子能让孩子玩半天！					",2019/6/14
huanqiuriji,"什么都不说了带孩儿来的看战果吧。主要是能让孩子知道瓜果蔬菜是怎么长的！老板一家子都特别热情！尤其是老爷子特别爱聊！聊了半个小时！品种也很多棚里摘西瓜黄瓜西红柿辣椒甜椒！甜瓜还没成熟，摘完后现场直接开了一个瓜特别甜！再过半个月来摘大西瓜和甜瓜！					",2019/6/14
sundi_2622,"上次详细点评了这次又去了第一次没什么人这次人太多了！这次给大家报下西红柿🍅的价钱10/斤好贵…茄子🍆8/斤也贵感觉这次真不该摘蔬菜。上次没人的时候送了几个，今天手里拿了个西红柿阿姨还特意说了一句。第二次去的时候下大雨开了1个多小时，棚子倒了没摘到…					",2019/6/11
可儿*:..,"孩子爸爸热衷摘西瓜🍉...好好的逛公园拍汉服计划变成了下地摘果子...这家西瓜棚听着导航就可以找到的不是什么犄角旮旯的位置人家是自家地种植除了西瓜还有西红柿小黄瓜之类可以采摘挺丰富的买之前让品尝觉得好再买让老板带着选了一些不错的价格5块钱一斤这种吊瓜一个差不多3到5斤左右吧环境的话就是晒还热进了瓜棚更热门口有一些给小宝宝玩的小型玩具还有一窝小兔子宝宝可以喂食给它们吃吃喝喝不过孩子更热衷吃西瓜...西瓜甜度很高水分也足打开一个也不必担心吃不完推荐推荐！					",2019/6/10
妞哒啦妞,"通过网上找到的这家，上午来的时候都已经十点多，有点晚了，但人特别多，这个时候好的瓜果蔬菜都被采摘完了，剩下的黄瓜，西红柿，茄子，辣椒都光光的，只有西瓜可以采摘，不过西瓜确实好吃，沙甜沙甜的，以上这些都生长在大棚里面，大棚外面还有几棵桑椹树和一些野菜，可以随便采摘哦					",2019/6/9
陈小猪_6478,"天气越来越热了，超市的西瓜也越来越贵了——自己采摘真的是又美味又划算！选了这家评价非常好的崔鲜生，体验极佳爱吃西瓜的朋友们一定不能错过！！驾车大概一个半小时，上午出发（推荐早去凉快，不然中午大棚里真的巨闷热）。位于采摘园区挺靠里的位置，但跟导航走很好找到，靠土路路边停车就ok。园子入口处是挂有“崔鲜生”牌子的撘的棚子，前两天10级大风给吹散了，现在还乱七八糟的正在重撘老板人很好，而且非常热情！进去之前还随便切了个瓜试吃——真的超级甜还水特多！然后提着篮子带我们进里面的大棚摘瓜，一边作介绍一边教我们挑瓜的窍门。西瓜吊在瓜藤上，个头都不大，颜色鲜亮和纹路清晰，十分精致，在翠绿的藤叶和金灿灿的小花之间居然显得还挺好看老板说培养的时候都非常严格，为保质量每条藤上都要薅掉多余的瓜（能看到许多被薅掉的小瓜掉在地上）。不同生长期的瓜上都系了颜色各异的绳，老板会告诉你什么颜色绳子的可以摘，其他颜色的还在长注意不要摘错了。看上哪个用小剪子一剪就断，瓜蒂的断口处冒出的汁液都是甜的还有第一次知道西瓜的叶子和藤蔓这么剌手，伸手进去扒拉西瓜的时候被剌得胳膊都出道儿了OTZ摘了10个瓜只花了200块不到，价格真的非常美丽！而且保甜真的太实惠了！！超市随便买一个晶鑫或者麒麟都快一百还不一定脆甜——现场开了一个小西瓜吃，沾刀就裂，瓜又脆又甜水还特别多，刚摘下来却自带清凉，皮薄而且没有黑籽（只有白的可嚼小籽）；令人惊异的是不光临近瓜皮处，就连蒯到露出白绿色的瓜皮都是甜的真的是完美的西瓜最重要的是回家几天吃光光，每一个的质量都是这么棒，晚上看电视来一只简直快乐到不行重要的事情说三遍，甜到爆甜到爆甜到爆，据说甜度13起步这还不是最甜的，可是我觉得已经足够甜了有好大一笼的兔兔，超多超可爱，吃剩的瓜皮隔笼投喂，一下子都挤过来啃得精光，感觉它们成天吃脆甜多汁的瓜皮伙食也是挺好的大棚里还有别的蔬菜，黄瓜西红柿尖椒等等好多，这次只买了西瓜走，超级满意的下次再来！！！还去超市买什么瓜，车程还和在市内堵车耗时差不多，都给我来采摘啊！！！					",2019/6/9
王蕊_9033,已经是第二来该园釆摘西瓜啦，真的是很甜、不错的西瓜哦。,2019/6/8
果妈,采摘的种类很多，除了甜甜的西瓜，还有西红柿，黄瓜，茄子等等，老板是对小夫妻，真的人很nice，会认真讲解一些挑西瓜的小知识，特别好，带小伙伴来采摘，大家都很开心,2019/6/8
大臣_4871,一家人特别热情，和同事们玩儿的很开心，了解到很多品种，非常满意,2019/6/7
貓貓022,一定要来的地方，夏天是吃西瓜的季节，庞各庄的西瓜好吃,2019/6/7
镌凌JL,服务特别好。。小西瓜贼甜！！！采摘也不难。。但是要去大家都不怎么去的地方才能找到已经熟的瓜~就是土太多了，昨天还有点刮风。。车上会进土。其他好评！,2019/6/4
猜猜,西瓜特别甜，服务很热情。小西红柿更好吃，买少了，路上就吃完了，下次采摘多来点。,2019/6/3
徒步飞行南瓜酱,端午节带着大宝贝来庞各庄采摘西瓜，小朋友玩的很开心，自己亲手采摘的西瓜西红柿茄子辣椒超有成就感。西瓜和蔬菜都是五元一斤，西瓜超甜，老板很热情，还切西瓜给大家吃,2019/6/3
