用户名,评论,评论时间
莱格宝儿,"大兴庞各庄崔鲜生采摘。导航去的，东三环到那边不到一个小时，回来一点都不堵，半个小时，很方便。单不说有没有果蔬可以摘，就是去这样的一个地方逛一逛看一看，心情都是很美好的。要是存着心要摘瓜果蔬菜，就一定周末的早上早早的去，据说一早上和一上午都被抢光了。我们2点过到只能摘西瓜，5块钱一斤，当场吃了一个，脆嫩多汁，好甜好甜的。逛了一下周边的大棚，貌似只有这一家人最多，特别明显，据说是它的宣传和线上的营销做的好。不过年轻的小两口老板确实能说会道，CRM能力很强。下次可以再去逛逛。					",2020/5/24
威利妈咪,"一直想来大兴庞各庄摘西瓜，正好在抖音上看到的崔鲜生，周末就带儿子来体验一下。他家蔬菜西瓜都有西瓜脆甜，棚子里有点热，每个西瓜都有标记，只能摘红色和黄色绳子的，因为已经成熟。黄色的柿子很少见，柿子味很浓。西瓜5块钱一斤，蔬菜西红柿是10元一斤，价钱不便宜，就是让孩子能够体验生活，懂得珍惜劳动所得。					",2020/6/7
一二三四五六小姐姐,"认认真真写点评#跟着导航走，七拐八拐就到了，西瓜不贵¥4一斤，跟市场差不多价格，孩子玩的非常开心，3岁半可以自己剪瓜，瓜很小，完全可以孩子自己拿，还有两个大棚是蔬菜，西红柿🍅黄瓜🥒辣椒🌶️茄子🍆刚好让小朋友认识一下蔬菜如何生长的，老板娘夫妻俩人很好，你说要尝瓜，就给你切，虽然不是主动让大家品尝，人着实是太多了，门口有个小水池给孩子们钓鱼玩水用，整体不错，还会选择来这里					",2020/6/5
ZSZC,"已经开始营业了，人还很多呢，五月底刚去过，百度地图一搜庞各庄采摘就是他家了，顺着导航过来，门口有停车位还不错，可以自己采摘，瓜五块一斤，蔬菜五到十元不等，西瓜没让品尝，九点多到的，大棚里的温度得有四十度，店家说早上五点就开门了，要摘最好早来，最后两个棚有蔬菜，小西红柿特别好吃，酸甜味浓，也有摘好单卖的瓜，统一价五元，瓜回去吃了真的很甜，就是皮太薄容易裂					",2020/7/1
妥妥的吃,"这家可以强推一下，因为是我近几年去采摘里面，除了西瓜其他菜品最多的地方。光西红柿就好多个品种，大棚也很多。摘完了在那洗了一个吃，老妈说不是催熟的味道很不错。黄瓜一个个顶花带刺的，光吃这两种就解饱了吧。本身是休园因为大老远过去了，所以老板人很好，也让进去了。这家也不会像别的地方使劲看着，全凭自觉。别给人家乱摘，别浪费，这是最起码的素质。我就进去看着小老弟，别让他踩着别人秧苗就行了。全摘下来价格也可以，也没乱收费。门口还有小朋友玩具，还可以歇歇脚。事越少生意会越好，和气生财嘛。从老七几个月就抱着他进草莓棚开始到现在，他也规矩多了。知道哪些不能摘哪些不要浪费。每年除了苹果，西瓜，葡萄，草莓，桃子，以后采摘蔬菜这个地方可以再来。毕竟来玩为了心情，这可比好多像防贼一样防着的地让人舒服多了					",2020/6/2
謝小宇,"刷抖音看到的看评价超高导航过来的导航位置很精准一路两边都是大棚唯独到他家门口挺满了车人很多生意很好老板是夫妻俩都是80后沟通无障碍人很好细心介绍各种品种的西瓜26种西红柿品种蔬菜品种也很多环境不错而且很卫生可以洗手也有卫生间采摘完在大棚下乘凉抽根烟大电扇吹着挺舒服西瓜可以品尝味道不错特甜西红柿有好多没见过的品种味道都不错价格便宜性价比超级高					",2020/6/26
7鈖隞氣,"开车过去的，一路导航，导航位置很准确，按着导航走就可以了我们九点半到的，人已经很多了，先去摘的西红柿和黄瓜，可能这日子口去，大多数已经被摘完了，我们进大棚里黄瓜没有几个了，西红柿倒是很多，品种也挺多的，有的品种好吃，有的就一般了。摘下来直接擦擦就吃，找到了小时候的感觉。西瓜上面都系好扎带了，进去之前告诉你哪个颜色是成熟的，看颜色剪下西瓜就好啦。结账的时候，老板会在检查一遍西瓜好坏，如果听着声音不好，会给你换一个，不让你带走一个坏瓜。门口有几个儿童的玩具，捞小鱼之类的，好多都是带孩子去的，采摘完了，结账的时候孩子就开始玩起来了。					",2020/6/13
Summer,"交通：按导航走下了庞各庄收费站在开个两三公里就到了，他们自己标的地址十分准确特色体验：第一次来这里，带着我的小卷毛，庞克庄的西瓜是出了名的好吃，决定自己采摘，6块钱1斤的西瓜，滕上有标记黄色和蓝色的绳子是熟透了的西瓜，老板会给你准备好小篮子和小剪子告诉那个棚里的可以摘取！还有各种蔬菜，比如，黄色的西葫芦，白色的茄子，还有各种品种的西红柿等等！可以让小朋友自己动手操作，体验一下生活！很棒的地方推荐理由：蔬菜是和市面价格差不多，值得购买					",2020/5/15
yoyoyo,"☀️这个采摘园有一种发现新大陆的感觉一个月去了5.6次难道还不能说明问题我是没见过比这还精心用心的老板了关键老板人还特别好接地气也很健谈🌼西红柿🍅老板种了20多种真的是可以当水果来吃不好吃的品种老板都没种无比追求完美💯黄瓜都已经进我肚子里了忘记拍照了不要炒菜不要凉拌必须生吃不然浪费🍆还有茄子青椒辣椒菜花秋葵…蔬菜很多关键真的好吃每种都是精品更是艺术品🍉最后不得不说说西瓜了好吃🍬真甜在外面你很难买到的品种基本没有我一个不吃西瓜的一天得吃半个瓜老板家里西瓜都种了30多年了还有比这更专业更专一的了吗？包装贴纸海报全部老板亲自设计的呢吃完崔老板家蔬菜和西瓜我敢保证你想天天去买着开心吃着放心身体健康还有比这更重要吗？📍🛒不得不说这周我已经去过了期待下周我与你在采摘园里偶遇哟					",2020/6/6
落落茜,"夏天想吃好吃的西瓜，一直买的不是很理想，于是自己摘去吧，在著名的庞各庄开车还是挺方便的，很快就到了，附近都是摘西瓜的大棚，但好像也就这家很火，门口都是车先了解了下价格，西瓜5块一斤，西红柿10块，其他蔬菜8块拿着小筐带着娃去了，大棚里特别热，感觉得40多度，娃最喜欢西红柿，于是多摘了点，蔬菜类，黄瓜感觉熟的少，茄子看着不错西瓜按老板说的绳上的颜色摘，因为太热了赶紧摘了4个就走了结账处人不少，等了得有一刻钟，边上有两只兔子可以喂，还有大水池里有塑料鱼可以让娃捞着玩					",2020/6/14
有所谓吧,"早就听说庞各庄的西瓜有名，现在是第一茬瓜成熟的时节，赶紧来打卡。害怕跑空，去之前给老板打了个电话。一过瓜乡桥就能看到路边很多卖西瓜的商贩，老板说那都不是本地的，很多都是山东来的，正宗的庞各庄小吊瓜是直把。老板带着我们进了瓜棚，上面绑着黄色签的就代表成熟可摘，往里走有两个蔬菜大棚，种满了西红柿、黄瓜、茄子，只不过现在熟的不多，得好好找找。西瓜9块一斤，西红柿10块，我们摘了五个瓜，几个西红柿，一共200。不算便宜，但是瓜真的好吃，超甜超新鲜。是个周末游玩的好去处～					",2020/5/13
飞鱼再升,"我觉这家店在大众点评上高评分真不是徒有虚名，老板娘确实是热情之中透着爽快，交流起来很愉快，有问必答，关于采摘方面的细节都能给点出来，采摘不踩坑，顺利不紧绷大棚里面挂红签的是可以采摘的西瓜🍉但是不多了，因为前两天周末被摘走不少，西红柿🍅熟的还挺多，西瓜6块钱一斤，西红柿10块钱一斤，看起来似乎不便宜，但是你去地里采摘时就知道为什么了，有些西红柿还没成熟会因为采摘时被碰掉了，多少会有一些损耗，还有西瓜大棚外面扔掉好多掐下秧的小瓜蒂，小小的没有熟就被抛弃了，因为这样可以提高挂果的质量，小西瓜才会茁壮成长，也不会互相抢养分。我有机会一定会再来，确实是家不错的好店					",2020/5/20
Lisa_867,"又到了西瓜成熟的季节啦！忍不住流口水，所以又跑到庞各庄，这里是北京西瓜采摘聚集地，有很多采摘园。庞各庄西瓜也是用它的清脆，爽甜在这几十年间打出了金招牌。所以随便选一家瓜园基本都不会踩雷。崔鲜生瓜园不小，好几个大棚，吊秧西瓜5元一斤，皮薄籽小。还有西红柿等蔬菜采摘。养的兔子也很可爱。有孩子喜欢的钓鱼玩具。					",2020/6/13
南城七哥,"开车到庞各庄准备去踩瓜，无意中发现了这么个瓜棚宝地！老板地道北京小哥，特别低调的告诉我们，咱家五一来人多了，你们进去看看可能还有少量成果…不过当走近棚区发现我勒个去那么大那么多…进去还真是跟着建议找了一些黄色标记的成瓜，然后隔壁几个棚还有新鲜的西红柿，茄子，尖椒，甜瓜，主要是西红柿就好多好多种，各种不同，一下就有了新鲜感！最终小哥介绍了家里一宝就是这个大葱哈哈哈果断提上铁锹，让小哥帮忙锄了十几颗！从来没吃过这么好吃的大葱，爽脆发甜！带家人郊游可以选择。点赞…					",2020/5/11
雨点amy,"这已经是我们固定的采摘点儿了。今年头一茬西瓜又可以摘了，利用周末赶紧过来，可惜来晚了一步，到棚里一看，今天能摘的西瓜，西红柿，豆角都被早上来的人摘光了，生意简直不要太好了呀。我们跟老板已经很熟了，就让老板从他自家摘下来的西瓜里面挑了几个带回来。到家就迫不及待的打开一个尝尝，还是原来的味道，西瓜味儿非常浓郁，绝对是消暑解渴的首选					",2020/6/6
匿名用户,"夏天和西瓜最配了。娃儿们快开学了，选个周末带娃去摘西瓜。点评上搜了一下，看点评推荐，打电话咨询后，选了崔鲜生这家。【位置】按点评地址导航，非常准确。这家不在柏油马路边上，要往里面走一小截，人很多，车都停在路边。【采摘】我们摘的西瓜，瓜棚很多，老板告诉几号瓜棚正适合摘，黄色、蓝色绳的最好，黑色的也能摘，红色和白色的不要摘。不同时间种的吧，所以成熟期要隔几天。瓜棚里很热，黄色、蓝色的剩的比较少，我们摘了几个蓝色的，又挑了几个黑色的大一点的。【西瓜】采摘5元一斤，回家洗了切开，水多很甜，比超市买的好吃。					",2020/5/27
小玩za,"交通：自驾最方便，下了高速用不了多久就到啦，他家不在路边拐弯进去才可以，门口可以停车，但是地方不太大。特色体验：有好多个大棚，占地面积不小。跟老板会告诉你哪个棚有什么，拿上🧺和✂️就去采摘吧～西瓜都贴心的系上了绳子，按照绳子的颜色采摘准保熟，虽然瓜不大，但是可甜了～蔬菜品种也很多，辣椒🌶️、茄子🍆、黄瓜🥒、卷心菜、西兰花🥦、西葫芦等等在一个大棚里，好多都还没长大，还是小小的蔬菜baby超可爱。大番茄🍅小番茄在另一个棚里，西红柿红的没几个。估计熟透的早就被摘完啦～大棚外地里还有大葱、小葱、菜花、洋白菜、桑葚树可以参观一下～采摘完老板娘给称重，🍉5元一斤，蔬菜5块、8块、10块一斤的都有。还有超级可爱的小兔兔可以投喂，留下一袋洋白菜给他们，吃的特别香～tips：建议早早就来，大棚里太热了，九点多到的完全是包场呀！十一点人就非常多了久居城里的孩子看看这些还是非常开心的！@北京点小二					",2020/5/28
你家de小主,"小狗子爱上这里了，跑得不亦乐乎，看到奇怪的黄瓜，在原地研究了好久今天中午去的，人超多，一口气摘了20来个西瓜，不枉费来这么远跑一趟，主要是太好吃了，冰箱里镇上个半天，拿勺子呱呱吃，贼甜、今天还摘了很多蔬菜，西红柿看起来超新鲜，立刻回家开吃，哈哈哈老板超级热情实在，持续推荐来哦					",2020/6/6
小歪勺,"本来是直奔地笼宝采蘑菇来的，由于蘑菇所剩不多，孩子没玩够，就在附近搜了一下其他采摘，看到崔鲜生态园的评价很好，又刚好离得很近，开车几分钟的路程，马上就过来了。老板人特好，果然和点评里说的一样，非常的热情，又实在，帮我们介绍，由于今年气候不稳定，所以很多品种蔬菜都还没熟，不过已经熟了的西红柿真的是太好吃了，因为就是带孩子去玩的，所以摘的有点少，回来一尝后悔了还好加了老板微信，只能坐等老板发朋友圈后再去了					",2020/5/12
会吃的猪兔,"今儿个特意跑来庞各庄摘西瓜，崔鲜这家在咱点评上排名很靠前，想必有一定道理，所以没犹豫直奔它家来了!果真很惊喜，因为它家不但有西瓜🍉，还有蔬菜可以采，黄瓜顶花带刺的真是新鲜!孩子们也有的玩儿，门口的小兔子们就很招人爱!老板夫妻俩挺热情，价格也公道，下次会再来哒!					",2020/5/28
喵哥北京,"交通:就在大兴机场不远处，开车畅通。品种:主打西瓜。品种是叫什么我也不懂哈，成熟后个头小，皮非常薄，适合小朋友采摘的小型瓜。很甜，有包装盒，送人划算。另外还有蔬菜:茄子，辣椒，黄瓜，甜瓜，番茄，南瓜，香菜，水芹，豆角还有户外的大葱等等。面积:不大不小，夏天中午棚子里有点热。价格:性价比不错，老板人很好，每次都会送一些。还养了几只小兔子，小朋友可以喂兔兔。					",2020/5/21
Ax憬奕,"交通：路途遥远🚙🚙累死我了🧘🏻‍♀️太远了特色体验：一家三口。相约好友一起亲子游。太热了。天气真是好的不得了。☀️🌤🌦周末人真是多。我们1点多到那，那人***真是多的。棚里热的蒸桑拿，蔬菜来晚真没有，可能9-10点估计有。西瓜大把的是。很多大棚，老板应该是分流的，要不一天把所有棚打开，这周日就没得摘了黄瓜🥒和西红柿🍅真的很好吃。自家种的味推荐理由：西瓜很甜，皮薄，下刀就自己裂开。					",2020/5/23
懒兔范范,"沿途有好多采摘园，冲着点评的好评直奔这里。人很多啊，十一点多到的，蔬菜已经所剩无几了，据说六月份应该会成熟的比较多。西瓜不少，最近可以采摘的是蓝色和黄色绳的。西瓜真的超好吃啊，皮薄，甜，水分多。来的基本都是好几兜子的买。来之前我电话问了两家，这家回答很周到，菜有好多品种。最重要的西瓜便宜，另一家8块一斤，这家五块，这两天刚调的价。小孩玩的很开心，可以喂兔子可以钓鱼。玩的不亦乐乎。					",2020/5/23
倩倩_505009,"本想着工作日人会少一些，没想到不仅人不少，即使在雷雨交加的天气里都没阻止了大家采摘的热情。还好天气不热，在大棚里采摘会舒服很多，这家的西瓜味道不错商家都给大家绑上成熟的瓜的标识，采摘踏实放心咔嚓一剪子落入篮子中。我们还顺便摘了好多西红柿和黄瓜，瓜果香味四溢，我们都吃了个肚歪。良心商家，实在热情，期待6月份再来					",2020/5/22
bling泡泡儿,"周日上午趁着好天气驱车去庞各庄摘西瓜在点评上看这家排名靠前所以直接导航过去。快到目的地时看到小道两旁停的车就知道人不少，果然一过去先看到他家的棚子，人头攒动太热闹了。拿好筐和剪子去瓜棚里，能摘的棚子不多，符合成熟期能摘的瓜就更少了，冲着这么多人来就知道剩不了多少了摘完瓜交完钱还可以现切了吃，味道倍儿好桌椅旁边还有一个冲气的小水池可以让孩子们玩玩水。除了人有点多，总体来说体验不错！					",2020/5/29
dpuser_86385907955,"[圆图钉]地理位置：大兴庞各庄西瓜采摘特色推荐：藤摘小西瓜🍉采摘蔬菜🥬前段时间正好去大兴路过庞各庄那怎么能不去摘西瓜呢这会下来的都是藤上的瓜，6月份大西瓜才能熟，所以这会都是用剪刀✂️直接采摘的西瓜藤上面给打好易拉宝黑红蓝标志着熟了小朋友摘了好几个给他开心坏了跟我说下次还想再来摘西瓜周末可以来这边采摘除了西瓜还有伊丽莎白西红柿黄瓜茄子豆角离采摘不远的地方有个龙湖天街可以饱餐一顿老板和老板娘是小两口，特别好说话，好聊天加了微信，喜欢吃的可以直接包邮到家					",2020/11/24
匿名用户,"第一次去自己采摘，带孩子去见识下西瓜的长法，顺便也认识了其他的蔬菜，孩子玩的挺开心，我也挺开心，就是去的时候有点热，自己摘得瓜就是好吃，也的确比外面买的那种大的瓜好吃，我们一下整了6个！下次再去再弄点的！					",2020/9/17
谁还不是个小可爱,"孩子喜欢吃西瓜，但是没体验过采摘西瓜，就跟三家朋友约好，一起去采摘，几家人就围着这么一个孩子，大棚里太热了，除了我他们都进去体验了，我在外面等他们，可不想刚出门，衣服就湿了，哈哈😄收获满满，西瓜个头儿不大，但很甜很甜，孩子很开心！					",2020/7/25
Ababyagain,西瓜很好，瓜皮薄，而且特别甜，交通也很方便,2020/7/17
慢性子暴脾气爱旅行,总体还算可以，之前去的了，现在才来评价。就是这个时候了也没啥东西了。,2020/7/9
捞汁儿皮蛋,"再次来到崔鲜生采摘园，西瓜品质依旧很好，老板人很好，坚持品质一流，摘了六个瓜，均被老板定为不合格西瓜，哈哈，老板亲自下地给摘了五个回来，不合格的那些瓜，老板都没有要钱，特别实在，这次还给打了八折，真是很棒啦，以后还会去的，西瓜好吃好吃好吃					",2020/7/6
悟炫,"来采摘西瓜服务真的很好细心的告诉我们应该采摘什么样子的最后结账的时候不好的西瓜也会帮我们挑出去但是暂且不说采摘的价格西瓜是真的没一个又甜又脆的后来在路边买的又甜又脆他们家的西瓜软软的肉也不是很甜真的不好吃感觉西瓜都长过头了要不然就不是头茬瓜					",2020/7/3
芳宝贝0726,"又到了西瓜采摘季节啦今年听取朋友建议，选择了这家店位置就不多说了，大兴区庞各庄镇这家店门口有小孩可以玩的地儿，还能喂兔子棚里真的太热太闷了，西瓜5块，西红柿10块因为是工作日，人还真不是很多					",2020/7/3
庄卉卉是个机智的小孩,"感觉还行吧(灬´口`p[💕o｡ιον∈｡o💕]q，西瓜都是大棚里面种植的_=͟͟͞͞(๑•̀=͟͟͞͞(๑•̀д•́=͟͟͞͞(๑•̀д•́๑)，其实挺重的(੭ु›◡ु‹)੭ु˄̻ ̊˄̻ ̊˄̻ ̊˄̻ ̊，一个女孩子也就抱俩就拿不下了					",2020/6/25
dpuser_6961795239,"庞各庄的西瓜真的不是吹的，吃过了真的会嫌弃世面上的普通西瓜，这家采摘我们每年都要来个一两次，真的是超火啊，我们周六11点到哪里就已经满满是人了，青菜已经采摘不到了，不过西瓜管够，可以尽情的摘，听老板说天天都这么火爆，口碑棒棒哒，蓝天白云的吃口刚摘下来的西瓜，别提多美了～					",2020/6/11
小新爸爸,"第二次来这家，是因为喜欢他家的老板娘。第一次来时候老板娘肚子里还怀着小宝宝，今年宝贝都长大了但老板娘一点儿都没胖，还是貌美如花。今天去的时候人超级多，茄子都没有大的了，🍅倒是挺多的，10块钱一斤价格去略贵。🍉5元一斤，我们摘了12个花了280块钱，虽然比外面买贵不少，但是胜在孩子体验的感觉和新鲜度。					",2020/6/11
duolinger198,"这家崔鲜生采摘，我是在大众点评搜到的，看评价比较好就慕名而来。他家不是在路边，真是在西瓜地里，没有导航真心找不到。周末人太多了，停车都费劲。他家不仅仅可以采摘西瓜，还可以采摘蔬菜，蔬菜品种特别多。老板特热情。					",2020/6/11
jun85032611,"一下大兴机场高速就一大堆买西瓜的和大棚，按着导航走没错。这个大棚人气好旺，老板也很热情，接电话问路和周边吃饭的地方都很详细，他家相比其他采摘的，多了很多种蔬菜，价格也很实惠。老板娘忙着称重，老板装箱，很是忙碌。我们周六上午去的，人好多。摘累了门口还有椅子和凉饮料卖~很多人除了西瓜，还摘了各种各样的菜，菜花西蓝花，黄瓜，西红柿，普通茄子，还有白皮茄子，豆角，南瓜，辣椒，柿子椒，应该还有其他品种。采摘了好多，丰收的一天！					",2020/6/9
霉霉__,"周末人太多了，车位也不好找。建议大家错峰出行，周末尽量早去，方便停车，采摘游客也不是很多。他家不仅仅可以采摘西瓜，还有可以采摘蔬菜，有黄瓜，茄子，辣椒，柿子椒，扁豆，菜花，西红柿，等等，品种非常多。老板很热情。					",2020/6/8
可爱婧婧0124,"大众点评搜到的这家店，提前给老板打过电话，确认好有东西可以摘才过来的。他家西瓜大棚很多，但是没有几个棚可以摘，很多还没有成熟。赶上周末了，车停的非常多，他家采摘游客也非常多，老板有些接待不过来了，采摘的小箩筐也没有啦，尽量还是早来。					",2020/6/6
福气,"看大众点评来的他家，他家在最里面，但是去他家的人真的是超多，有种“酒香不怕巷子深”的感觉。第一次去他家，瓜成熟的还不多，老板很实在的建议我六月再来摘，口感好，价位更合适，但来都来了，顾不了那么多了，买吧，不过瓜确实很甜，就是成熟度稍微差了那么一点。五月底再去的时候，我居然没买到瓜，人太多了，下次还是找个工作日再说去吧。					",2020/6/6
king22915,蔬菜种类：西红柿种类挺多的，还有茄子、黄瓜、小葱、豇豆角，现摘的比较新鲜。环境：有孩子玩的秋千跳床。服务：卖家比较细心，会把坏的挑出去，很贴心。,2020/6/6
巨蟹717,特别好的一次体验，老板为人处事特别好，处处为顾客着想，最后还给打折，特别划算。下次还回来！🤗🤗🤗,2020/6/6
福小宝,今天上午又去采摘了，摘到了秋葵并且有和别人共同分享。西红柿真的很好吃。我一次摘了六个品种。西瓜🍉很甜。我是长客。,2020/6/6
头头的猪猪0619,位置跟着导航很好找。老板人很nice，西瓜5元/斤，按着老板的指导，每个都很甜。他家西红柿也不错，是小时候的味道。下次还会在去。,2020/6/4
mickey的美丽人生,"周六一早8点就到了，店家因为很多西瓜和蔬菜成熟的不多，还是暂停营业的状态，但是并没有拒绝我们来采摘，很感谢店家。目前有3个大棚的西瓜有熟的，看图品质很好，特别甜，水份足。蔬菜品种多，🍅🥒🌶️🍆什么的。黄瓜品种多，意外还收获了一根日本品种的🥒。店家说过几天另一拨西瓜就能下来了。蔬菜品质很好，味道不错。价格嘛，还可以，🍉5元，🍅10元，其他都是5元。交通：走大兴机场高速过来特别方便，路况也好。					",2020/6/1
zw125516,"庞各庄西瓜最好吃的时候，前几天跟小区邻居们团购的，没吃够，自己决定去摘，😄，超级甜的小西瓜，春暖花开的时候，可以出来走走，放松下心情，在摘点甜甜时大西瓜，不错的体验，再过一段时间西瓜就没有了，想吃的亲们，抓紧喽！					",2020/6/1
踏雪寻梅008,"周末来采摘西瓜，人太多了，有点顾不上来了，导航可以直接到，位置挺好找的，停车也方便，有西瓜还有一些西红柿等蔬菜，准备了小孩的玩具真不错，采摘也方便，老板都用各色绑带弄好了，看颜色就可以采摘了，越大越好越甜，也有老板早上摘好的，都很新鲜，价格也合理，质量有保证，都很甜，非常满意，还会再光顾的					",2020/6/1
扬_2122,"前一天问了老板高峰时间，为了错峰我们早上9点就到了，我们到的时候是第一个，老板大棚还没开！我们摘了很多小西瓜！现在就小西瓜是可以摘的，大西瓜得六七月份才可以！还去蔬菜棚摘了些黄瓜！西红柿感觉都还没怎么熟就没摘！西瓜吃了都很好吃！下次还来					",2020/5/31
