用户名,评论,评论时间
LHY,"这家也收藏有一阵子了，趁着六一带女儿过来采摘。按照点评地址导航过来没问题，沿路全是西瓜地和西瓜采摘，这家在点评上比较火，所以来的人也多，他家大棚门口汽车都排长龙了。采摘前可以先尝，确实甜啊，女儿刚开时嫌没给她把籽抠了不吃，后来吃的都不走。他家有好几个大棚，主摘西瓜，都是吊秧的小西瓜，瓜秧上系了蓝色绳子的是熟了可以摘的，所以只要按绳子颜色摘就不会错。此外还有些茄子、黄瓜、柿子椒、辣椒、西红柿、小番茄，数量不多都是自然成熟，所以摘到后来数量就比较少了。西瓜现在5元一斤，我们摘了6个瓜，还有一点点黄瓜和辣椒，自己能摘的小番茄基本没有了，从门口的筐里直接抓了几把，老公交钱说总共150不到，所以价格很便宜了。门口有一个跷跷板、一个小牛椅子，我家小妞都玩了半天，还有一些兔子养在笼子里，可以喂西瓜皮。我们不到十点刚到时人还不算太多，等快十一点出来称重时人老多了。听见老板跟别人说他家西瓜陆续能摘到十一。回家我就自己开了一个小瓜，皮薄脆甜水分足，确实好吃！！！这家采摘最好的一点就是西瓜熟不熟已经有人给看好了，省去了怕摘完不好的烦恼！					",2019/6/3
*Ai_楊***,"这家采摘只有600这个品种，小西瓜，味道很甜店主还有草莓，西红柿，黄瓜的地。不过草莓过季了，蔬菜就西红柿还不错。从北三环开车1个小时到庞各庄。出了高速沿路有很多卖西瓜的大棚，价格都是4-5块钱一斤，不过还是抵住了诱惑一路沿着导航到了这家店。店主姐姐很热情，怀着孕帮忙秤西瓜。今天采摘是5块钱一斤，感觉价格不贵但也不是特别便宜					",2019/6/2
张郁斌,"刚刚摘了九个，五块一斤，超级好吃！进棚前店家阿姨告诉摘系蓝绳的是熟的，所以摘的很顺利。称重时在我们前边一家摘了七八个不到巴掌大的瓜，说是不知道哪个熟。。。有点儿替店家阿姨生气了如果说没听清店家说要摘蓝绳的，那也不至于分辨不出那么小个儿的瓜是吃不了的呀。店家一家都好善良，也不想让顾客带没熟的走，让他们又摘蓝绳儿的去了。					",2019/6/2
ryanlgkids,"#点评有礼#昨日午餐后即与家人驱车直奔京城西瓜产地大兴庞各庄，而大兴区采摘／农家乐评价榜排名第一的就是崔鲜生农园，也就是下午即将去的地方。依导航一路通畅，其位置在四李路与薛北路交叉口西北约500米，全程约50公里。老板一家都很热情亲切，先给我们切了一个西瓜，别看个头不大但薄皮沙瓤，色泽红润汁多，入口又脆又甜清香爽口，比平时吃的京欣和新疆西瓜要味美多了，真是名不虚传哦。西瓜采摘国面积好大，一片碧绿连绵不断，这里不仅有许多成熟和即将成熟的大大小小西瓜，还有翠绿嫩爽、顶花带刺的黄瓜和尚未成熟的番茄，孩子开心极了，自己摘了两个小西瓜和几条黄瓜，又和小免子玩上瘾，农村的田园风光深深的吸引着我们，尽管采摘活动又晒又累，但心情却充满了无限悦愉，家人们都享受着劳动带来的乐趣。					",2019/6/1
KATHY,"地点：大兴庞各庄，排名大众第一名，周日预报大雨🌧️还是前来，到了之后足足在车里等了二小时雨真是太大了，体验与众不同的天气☁️外出活动二字凉快，雨天更适合在大棚里活动在大棚里雨声啪啪的响，因为雨天只能采摘西瓜，老板说蔬菜下周才可以采摘，只能遗憾的采摘些瓜瓜回去，儿子看到老板家的狗狗🐶说它的名字叫巧克力我看给淋成咯汤🐶了，儿子说下次还要来看看巧克力希望下次能收获更多的快乐					",2019/6/1
Joyce126616,"夏天到了，吃西瓜的季节到了，今年特别想去庞各庄亲自摘西瓜🍉，所以就和家里人一起来到庞各庄，从城北穿过到城南真的不近呢。寻着导航来到这里，老板一家非常热心，我们根本不懂怎么看瓜熟不熟，他们说看瓜地栓的绳子的颜色就行，没几分钟就摘了好几个，真的特别甜😋。西红柿🍅还没有熟，等个一周十天的就可以采了，到时候还要来！					",2019/6/1
素可清心,"周末带孩子去摘西瓜！一下车就感受到老板的热情！先开了瓜给尝鲜！孩子拎着大框就奔着棚子去了！老板按成熟度给瓜系了不同颜色的绳子！不会随意摘错！太赞了！儿子每发现一个大西瓜就会激动的又笑又跺脚！自己减下来的西瓜，超有成就感！非常愉快的一次采摘！					",2019/5/31
小太爷爷爷爷,"庞各庄西瓜，真的好吃，就是远。西瓜10元1斤，一个3斤左右，非常甜，皮薄。老板会按成熟度系不同颜色的绳子，大家按颜色摘瓜就行。老板很热情，态度超好，院子里还有刚生的一窝小兔子，可爱～还有各种蔬菜可以采摘。					",2019/5/28
王正颖,"老板一家人，太热情了，一下车就先尝小西瓜，非常甜，我们着急采摘，摘错瓜地，大叔有点着急，非常理解，种西瓜很辛苦。把不熟的摘回来了。​有一个戴眼镜的兄弟，不让把不熟的买走。又去瓜棚给我们挑了6个熟透的瓜。非常感谢。还紧着说我没说清楚，不怪我们。心地太善良了。大家一定去他家买。					",2019/5/28
洛洛,"西瓜真❤甜啊！！！下周黄瓜，西红柿差不多熟了。。。6月据说大西瓜也要熟了！老板全家都超级好！大叔亲自陪着小朋友摘西瓜！还教我们怎么听熟西瓜的声音！现场摘完，直接开了俩吃！好嗨呦！有兔子喂！有秋千！还有小朋友玩具！					",2019/5/27
是非淡墨,环境舒适，服务周到，西瓜很甜，可以去玩。,2019/5/26
君王6437,老板一家人很实在，我们是几家子一起去的，老板就给我们切西瓜，很和善，本来还想着除了西瓜可以摘点蔬菜什么的，果园老板说，昨天6.1已经被扫荡的没有熟的了，有点遗憾，不过值得大家去一次,2019/5/25
米小米儿_2373,大姐服务很热情到位，西瓜还是上午去采摘好啊，下午都被扫荡一空了，价格还可以，毕竟这么辛苦呢，而且物价现在都这样了，还是超值的，就是回程京开有点堵车,2019/5/25
uliya624,西瓜好吃，就是有点远，不方便，老板可以发快递,2019/5/25
龙井蓝山,按导航找过去的，老板还出来接的，很热情的一家人，瓜很甜，孩子们每人摘了五个，拿不动了才停手。采摘在一个极地，不知道老板和基地有什么待沟通的，出门的时候差点不让出来，下次约了去老板家另一边的大棚。,2019/5/18
天使宝贝19991228,"孩子超级喜欢采摘，4月份去了一家采摘草莓，摘了不少，回家一吃不太好吃，孩子有些失望！于是老跟我说好要去采摘！5.1放假的时候决定再采摘一次，从大众点评选了一家好评最多的，我们是5.4号去的，由于是放假最后一天，又是下午，所以没什么人了，这家的人很热情，到了那直奔主题，就去就摘了8个瓜出来！这家是一对夫妻开的，老板娘还是一位准妈妈，老板娘非常健谈，人超好，还给我们切了一个瓜让我们吃，非常甜！而且他家种的东西非常不用，好多都是从国外买来的种子种的！非常期待，过段时间还会再来！					",2019/5/15
秀秀,"回来几天了没时间评论，不得不说从来没遇到过如此好的卖家，我们去打了几家电话都说还不能采摘，因为孩子特别想亲自体验一下，然后打这家电话，小姐姐说让我们过来找找熟瓜。到了后小姐姐陪我聊天，他老公全程带我儿子找瓜，还陪我儿子捡了一袋子小瓜玩，差不多两个小时的时候，带着我儿子各种玩，超级有耐心，我儿子完全忘记了我的存在我都羡慕小姐姐找这么有耐心的老公了回家两天了天天问我什么时候去叔叔阿姨那里摘西瓜估计这个夏天每周都会去摘蔬菜了，就当去游乐场了有人陪娃，蔬菜忘拍照了黄瓜番茄是以前老家的味道。最后祝你们肚子里的宝宝平平安安出生，健健康康成长，谢谢你们！					",2019/5/13
漪静,"今天临时决定去摘西瓜，不过赶上早熟西瓜的末班车了，老板家西瓜太抢手所以我们只能象征性的摘了6个老板说下周开始就有好几个大棚西瓜可以采摘，还有很多品种的西红柿，所以还是下周来比较好。听老板说能采摘到7月底不过大家去之前和老板联系一下，大众的定位有点偏差我们第一次开到村委会了					",2019/5/11
皓月儿0514,"大儿子玩的超开心！采摘黄瓜，豇豆，西红柿，西瓜，我们平时去的，可是包场喔！哈哈哈，晚饭就做了豇豆饺子，老板夫妻们都超好孩子还喂了半天小兔子，准备每隔一段时间就来摘点新鲜蔬菜水果，等老板搬了新的地方应该更多水果吧					",2019/5/8
Helen_Dong74,"东主热情好客，采摘体验感超级好，西瓜很甜，小葱很香。一般不爱写点评，这是用大众十年来第二次写点评啦！但也有不愉快的事情是点评里不能回避的，就是崔鲜采摘和别的采摘园在同一园区，别的园区的园主好客方式不太能让人接受，后去的摘友还是要和崔鲜采摘多多问情情况才好					",2019/5/8
dpuser_9813981028,"2号定朋友一起去采草莓，一开始不是选的他们家，去另一家草莓🍓都没了，最后选的他们家，之前就想着摘西瓜，拍太早，就去碰碰运气，路线很好找，一进门就见不少大棚，里面有很多西瓜，也有不少人来采摘，4.5.6号棚主要都是西瓜，瓜上有蓝色绳子是熟了的！白色和红色都不能摘，10块一斤！如果早些也有草莓，可以带孩子一次玩玩，挺好					",2019/5/8
coco911823,"原计划今天是去延庆的“世园会”，想到这五一人辣么多最后计划取消,选择了离家不很远的“庞各庄采摘”，位置很好找，里面随意停车，她家就在4、5、6号棚，先来说说老板是一对80后小夫妻+爸爸👨，热情，实在。因为过季了，🍓没采摘成，但西瓜🍉真心不错主要萌萌的颜值迷倒了我，孩子也灰常开心🥳。老板娘说拇指西瓜过一阵就有啦，还有蔬菜，准备再去对了，走时还免费让拔了地里的小葱。祝生意兴隆					",2019/5/6
米饭jiu菜,"老板很热情，态度很好，很健谈，可惜🍓过季了，没摘成大草莓，摘了些多小的，老板很好没算钱，白送，小草莓也超甜。收获最大的就是西瓜🍉，摘了20多个，西瓜🍉在那吃的一个，也是甜的没话说。老板还让我们免费摘了别的蔬菜，小葱，蒜头，小西红柿。下次还会光顾！！					",2019/5/6
小乐赫微,"从南锣骑车到这里，不摘点什么不安心。这家人很多，一直有人来。打电话问别人家都说什么都没有了。拍了西瓜，但是只摘了草莓🍓🍓🍓🍓，草莓是酸甜的那种，摘完了手都是香的很好吃，摘了一满盆才65~老板一家态度超好，送了西瓜🍉，打算端午再来玩！老板送的西瓜超甜~再次感谢					",2019/5/4
张佳_6886,老崔一家人都超级热情，关键是西瓜很甜，而且是小时候的西瓜味儿！还顺带着摘了一兜子马须菜...感觉不虚此行。5月20号左右据说下一波西瓜就熟啦，估计园子里其他菜也熟了...冲啊～,2019/5/3
高媛_906,没有预定直接来的，到了大门口才知道一个园子里有很多大棚，分别属于不同瓜农或老板，价格高，胜在新鲜,2019/5/3
小次老都不行,非常热情可爱的小姐姐老板，人特别好，给我们切西瓜吃，摘的时候还帮我们挑熟的西瓜，西瓜非常甜，走的时候还给我们自己种的小葱带走。采摘墙裂推荐她家哦。,2019/5/2
KLeeeee,第一次摘西瓜体验非常成功！热情好客的老板一家，脆甜爽口的迷你西瓜。随意尽情的各种品尝，收获满满的农家青菜。期待六月的大西瓜采摘！,2019/5/1
哒哒哒,蛮好哒，小姐姐人超级热情，五月底还在来。,2019/4/29
oscar,周末人多，带孩子过来玩玩，草莓不便宜还必须要带着他的筐来称重,2019/4/28
longmiaobi,"西瓜草莓都挺贵的，摘草莓孩子只是吃几个就被制止了，感觉不亲民，毕竟买了那么多，。那里有很多棚，只有他家最火，估计是大众点评排名的关系吧，应该都是差不多的，大院里很干净，墙上还有彩绘，估计假期人会更多，可以多逛逛，多问问，比较一下比较好。。					",2019/4/28
sunny海阔天空,"周末临时起意想采摘，通过大众点评搜了一下，综合距离和评价，选到了这家。一通电话过去，被女老板不俗的谈吐和温柔耐心的解答勾起了兴趣，采摘很满意！一家人做生意，和和气气。一对看过世界的、年轻洋气的夫妻，踏下心来做自己的采摘园，很了不起！不同季节有不同品种的蔬菜和水果上市，品种遍布世界各地，值得一去。					",2019/4/14
Aquarius小东西,"庞各庄采摘园位于大兴区，占地面积较大，进入采摘区有个人和公家两种，务必问清楚当地农民，一般他会带你进入私人大棚，一家承包三四个大鹏。分别是番茄，草莓，胡萝卜和西瓜。我们采摘的是草莓，品种还是不的，就是有点小贵，40一斤，重要是为了让孩子体验采摘的过程。去了番茄大棚，棚主人简单介绍了一下棚里未成熟的大番茄和小番茄。摘了一个熟的番茄，小番茄非常甜，大番茄是砂瓤的，也很好吃，这里的品种的很好。过段时间再过去采摘吧。这里的西瓜是小西瓜品种，薄皮的，还没熟，据棚主人介绍，口感都非常不错，非常期待四月底的西瓜啊！和孩子一起体会采摘的乐趣和果实的美味，非常有意义！					",2019/4/13
吃遍大兴,"这个采摘地方还是可以的，我们去的时候人不是很多，大棚里面温度还是有些热，采摘的草莓，真的好吃味道很香甜，西红柿别看皮厚咬下去汁多味道不错，他家还有黄瓜，奶油生菜，西瓜，品种很多，店家说过几个月还会有火龙果等等，总之他家真的采摘的东西挺多的价位还可以，孩子第一次接触采摘很是兴奋，有时间还会光顾。					",2019/4/12
花生豆和图图,"真不错！大众点评上找了很多采摘园，想找个干净的。看到这家图片宣传比较用心，就去了。真的不错，草莓超级香甜，管理员是一对80后夫妇，很健谈。给我们普及了好多农作物的知识。男主是很喜欢研究种子，夫妻俩全世界到处去买种子。把爱好当做职业才能做的更好。五月等蔬菜熟了我们还准备再去。					",2019/4/11
scorehe,"位置离家还算OK比昌**很多～从丰台开过来也就是半个多小时40分钟的样子～到了之后这个采摘园的主人非常热情带我们一起去大棚里采摘心情很好孩子第一次来玩的很开心～草莓味道不错价格稍微贵点，还摘了一些菜，黄瓜生菜胡萝卜，都很不错等西红柿下来我们再去～					",2019/4/7
大玉肉肉妈,"草莓好吃，真的是好吃的很！周日一早去的，三十一斤，自己摘，仨人摘了五斤多，海来了九斤西红柿，现在只有这两种好吃的，问了西瓜，得等到夏天喽。草莓特别甜，成熟度很高，香气扑鼻，孩子吃了不少，西红柿也是，一点儿也不酸。					",2019/4/7
王小悦,草莓35一斤，特别甜，美女老板非常热情，等西瓜熟了之后还来,2019/4/7
OoYugiiLoO,草莓一斤40，比较好吃。但是个头不大。给了一个塑料盆，按照草莓价格买的盆。好贵。,2019/4/6
kjssophia,草莓蔬菜西瓜都有价格适中环境一般,2019/4/6
最爱染小七,按照大众点评的地址导航过去挺好找的老板一家人很实在也很热情草莓🍓超级超级好吃口感棒棒哒另外还能采摘西红柿4月底之后还能摘西瓜还会再去的小朋友玩的挺高兴,2019/4/5
汐娘,老板人挺好，热情，大棚周围环境也好，一进大棚，都是草莓的味道，来的时候人也不多，红红的草莓采个够。一次愉快的采摘,2019/3/27
solo1214,态度好草莓甜觉得不错孩子吃几个也可以,2019/3/24
我是万能小v,特别好吃的草莓，比之前采摘的都好，开车也不远，借着周末来郊游了一下～4月份还打算来摘西瓜🍉,2019/3/24
媛～_5497,草莓非常好吃了老板人很热情强烈推荐哦还有蔬菜西瓜可以采摘,2019/3/23
单掌劈死驴a,"崔鲜生草莓园的草莓特别新鲜好吃！因为有孕在身不方便去采摘又特别馋草莓，没想到在生之前还能吃到崔鲜生家这么新鲜可口又放心的草莓，草莓大小合适，酸甜适口，还有就是送货特别快想吃不用等！赞赞赞！买了四斤还包邮！因为孕期吃东西都特别注意，查过草莓的益处有好多，算低糖水果也适合老人小孩吃，可谓是居家圣品啊！					",2019/3/16
兰阳阳的习复,"八月中旬又想吃庞各庄西瓜了，于是周末冒着要下雨的风险带着爸妈又跑过去摘西瓜，这次准备多摘点，谁知到那边一看怎么那么萧条啊，难道西瓜下市了？沿途还看到不少卖西瓜的摊贩，本想去上次那家采摘，爸妈说再看看别家咋样，点评上搜到这家口碑也不错，距离上次那家也不远都在这一片。到地方一看既没有采摘的客人也没有店家看管…瞬间心凉半截，刚要走，就看见个大叔出来招呼，一问西瓜早没了，说还有最后一波小西瓜得九月底才能摘了。来都来了问还能采摘蔬菜么，大叔说蔬菜还有最后一点，不多了，赶紧让爸妈摘，别白跑一趟。询问蔬菜采摘价格的时候，大叔有点为难，说他只是看着棚子，主理还是他家孩子，大叔电话把孩子叫来招呼我们，年轻人就是不一样，亲合力强，又会推荐介绍，原来他家园子的蔬菜基本种的都是国外品种，熟悉的蔬菜名字不一样的蔬菜味道和样子，目前还有番茄（红、黄芒果番茄）、茄子（紫茄子、白茄子、彩皮茄子）、苦瓜（黑苦瓜、白苦瓜），都已经所剩不多，价格都是10元一斤，我们几乎把能摘的都摘了，最后摘了10斤蔬菜！这些蔬菜从外观到口感真是跟咱们平时吃的普通品种不一样，据说在不同的月份还要种不同的国外品种蔬菜。摘蔬菜的同时，老妈还在大棚里发现了好多野菜-马陵菜，欢快的挖了好多！年轻人的思想就是先进就是不一样，加了微信，回家拌凉菜，苦瓜西红柿的口感都好吃，尤其是白苦瓜和黑苦瓜，苦味减少，水分增大，又脆又润真是好吃！					",2019/1/1
珼貝_1252,"其实是4月份买的西瓜了，为了积分才来补写的点评，还好相册里还有图片，据说是喝牛奶长大的小西瓜，一箱大的话有4个，小的话有5个，皮薄瓜甜，就是价格略高，但胜在品质好，连送人和给家里长辈买了好几箱，他们很喜欢吃。					",2018/12/31
舞hime,"打电话去家里买的小西瓜，皮薄汁多太好吃了，老板娘还说不够熟籽都是白的，但味道真心又甜又脆，带着孩子还进屋里吃了半个，剩下半个也顺道带走了，还跟家里很漂亮的小妹妹玩了半天，这趟来的很值，会推荐给朋友来。60一箱能装4-5个价格也算合理，纯正庞各庄小西瓜！					",2018/8/29
鹅的丫,来之前给老板打电话，好几家需要老板带一下，老板娘是年轻80后准妈妈，人很好，红颜酸甜口的味道不错还有蔬菜可以采摘，下次来试试,2018/6/30
蜗牛加油爬,现在草莓正当季哟口感超级好哈孩子老人玩的也开心关键是暖棚里非常暖和～!园主热情友善人好的没话说约好了天暖再来摘西瓜🍉,2018/6/12
向日葵嘻嘻哈哈,西瓜非常甜，老板人也很不错，很热情。我们先烧烤，吃饱喝足，开始体验采摘西瓜，可以说是满载而归。,2018/6/8
晴妍,西瓜/:<W>/:<W>超甜，皮特别薄，熟的特别透。最近少有的好吃的西瓜/:<W>！还会再来滴！,2018/5/28
鱻_7512,瓜很好吃，小丫头一口气吃了五六牙，摘了香蕉西葫芦，黄瓜和秋葵，老妈还免费拿了些马齿苋，老板一家很热情，估计再过两周还要再去一趟😋,2018/5/26
zzhang1234567,地方不错，西瓜必须好评，黄瓜新鲜可口，老板热情.农家大棚乐趣多多，值得再去体验……,2018/5/26
LS_5193,店家很热情，蔬菜和瓜果新鲜，味道好。,2018/4/15
魔幻小悠,正宗庞各庄的大西瓜，皮薄很脆。,2017/7/31
dpuser_62309307463,第二次购买了，同事推荐的，挺好吃的😋,2017/6/28
dp16542495,冰箱里冰了几天，今天太热，切开一吃，果然没有失望!冰凉爽口，香甜可口！整个夏天就靠它了！主要是瓜小，吃起来不浪费!刚刚好！良心卖家，一个,2017/6/20
spaghetti119,老板人老好啦！到了就热情招呼吃瓜，吃了再摘，摘了出来又让吃，吃得我都不好意思了瓜的皮薄，别磕碰，一碰就裂开了，糖分大，真甜！摘着摘着就装了一后备箱。分分就差不多了，下次再一块去！,2017/6/18
拾壹,"第一次去庞各庄采摘西瓜，从昌平沙河到这用了两个多小时。不过尝了老板的西瓜，觉得这趟跑的值了！小薄皮，又脆又甜的，弄的我这个孕妇根本停不下来！可惜离的太远了，又不敢多买……11个西瓜现在就剩下一个了，都不舍的吃了					",2017/6/18
桂璇_1172,导航很准确，路边停满了车，到了可以试吃，然后可以下棚自己采摘，西瓜非常好吃特别甜，皮很薄，每箱上都贴着关于种植西瓜的知识，支持微信，支付宝等手机支付，非常方便，以后还会再来。,2017/6/17
qinan77,今天终于有时间自己去采摘了，看着那么多西瓜，口水都快忍不住了，精心挑选了一个大个儿的，妥妥滴大半个到了肚子里，味道甜，水份也足，必须还要带回家几个！,2017/6/17
还没C太的自觉,超级好吃的西瓜，而且性价比超高，值得品尝。推荐给大家，不错的选择,2017/6/17
海游hg,小时候就喜欢夏天，因为夏天能吃上好吃的西瓜。慢慢的长大了，觉得西瓜不再那么好吃了，所以也不再期望夏天的到来。今年买了两箱崔鲜生的西瓜，感觉回到了小时候，这是记忆力夏天该有的味道。,2017/6/16
*芥末@冰激淋*,西瓜特别好吃！皮薄味甜～比普通西瓜要好吃很多～!,2017/6/16
pazzayang,吃过的瓜中这家是最甜皮最薄的，价格还公道，每年都来这家采摘老板特别热情,2017/6/15
臭猫猫猫,素材：收获满满，瓜巨甜，到皮都很甜，一次愉快的郊野游,2017/6/14
花腿儿咪子,"走过路过绝对不能错过,说的就是这家,西瓜特别物超所值,皮儿薄沙瓤还倍儿甜!买不了吃亏买不了上当!",2017/6/14
dpuser_4087457244,正宗庞各庄西瓜，皮薄瓜甜，味道非常赞！,2017/6/13
chrispj,超好吃的西瓜🍉，用勺子挖着吃太爽了！一次半个没问题，要是能吃的人，一顿能吃一个！,2017/6/13
情深深兮、一去不复返。,超级好吃的小西瓜，甜死了！！！而且还特别便宜，老板美女一枚！,2017/6/10
谁动了我咸菜,瓜特别甜，皮薄大馅的西瓜🍉！,2017/6/10
dpuserAt_1033067525,皮薄，甜美，纯绿色，正宗的天然西瓜，很是喜欢。,2017/6/8
夏沫_1614,朋友家的西瓜，味道很不错，下次还会再来光顾的。,2017/6/8
dpuserAt_0862103509,瓜很甜皮也很薄适合采摘总体不错,2017/6/8
筱远_1844,西瓜🍉简直太甜了，老板热情，采摘的人特别多，想去的抓紧啦,2017/6/8
dpuser_1788096370,今天又去啦，从来没有馋过西瓜，这次把上次的吃完，就每天都还想吃，吃上瘾啦😃,2017/6/8
昕懿,西瓜🍉超级甜，而且瓜皮很薄，休息的时候可以带上家人亲自动手感受采摘的乐趣，老板人很好，服务也周到，总之真的值得购买，推荐，同时也祝老板生意兴隆，财源滚滚来,2017/6/8
你跺你也麻_6139,瓜很新鲜，特别可口，服务态度也特别棒，真心值得推荐,2017/6/8
McDonaldss,地地道道的庞各庄西瓜~只要吃过一次就认准了…说什么都不如你吃上一口，吃上就忘不掉，年年都惦记啊~,2017/6/8
夏简紫0212,真心好吃，薄皮西瓜很甜，瞬间一小盆就吃完了，值得购买,2017/6/7
wl851222,物美价值，正宗的大兴西瓜🍉，蜜蜂授粉，子少瓜甜，带着孩子采摘挺不错，瓜农叔叔也付出了辛苦。种地越来越少，希望长期种下去，我们会经常关顾的……,2017/6/4
大力水手_1403,大兴庞各庄小西瓜。今年开篷第一季，刚熟的小西瓜，脆甜脆甜的。价格不贵。赛过海南麒麟瓜,2017/6/4
